### ISSUE TITLE
Failed to authenticate HTTPS connection

### ISSUE THREAD

**Issue by ComptonAlvaro** [dotnet/aspnetcore#43752]
### Is there an existing issue for this?

- [X] I have searched the existing issues

### Describe the bug

I have an ASP Core .NET 6 application that host a gRPC service. Just I comment it is for a gRPC service but the error is related with ASP, according to the log in the server.

I have a library for the gRPC client, that it is used by a WPF application and a MAUI android application.

When I run the ASP server in the first computer (computer in which I develop the solution) I can connect from my WPF aapliction and my android application from a device (no emulator).

if I install the ASP in a second computer (the production computer) I can connect from my WPF application, but not from my android application.

For the second computer, i created a certifcate with the IP of the computer, and I use the same CA to sign it. But I don't know why I can't connect from the android device. Also I have tried to create a unique server certificate, using localhost instead of the IP, and use the same certificate in both servers, but I get the same result, I can connect always with my WPF application but I can't connect from my android application.

In both servers, I am using windows 11.

The log in the server is this:

```
10:47:14 DBG] Failed to authenticate HTTPS connection.
System.IO.IOException:  Received an unexpected EOF or 0 bytes from the transport stream.
   at System.Net.Security.SslStream.<FillHandshakeBufferAsync>g__InternalFillHandshakeBufferAsync|189_0[TIOAdapter](TIOAdapter adap, ValueTask`1 task, Int32 minSize)
   at System.Net.Security.SslStream.ReceiveBlobAsync[TIOAdapter](TIOAdapter adapter)
   at System.Net.Security.SslStream.ForceAuthenticationAsync[TIOAdapter](TIOAdapter adapter, Boolean receiveFirst, Byte[] reAuthenticationData, Boolean isApm)
   at Microsoft.AspNetCore.Server.Kestrel.Https.Internal.HttpsConnectionMiddleware.OnConnectionAsync(ConnectionContext context)
[10:47:14 DBG] Connection id "0HMKF3CINKBA8" stopped.
[10:47:14 DBG] Connection id "0HMKF3CINKBA8" sending FIN because: "The Socket transport's send loop completed gracefully
```

The common gRPC library: how I create the gRPC service:

```
    public class ServiceClientGrpc : IGestorOrdenadoresServiceClient
    {
        #region constructores
        public ServiceClientGrpc(string paramDireccion, int paramPuerto, string paramCA, string paramCertificado, string paramKey)
        {
            X509Certificate2 cert = X509Certificate2.CreateFromPem(paramCertificado, paramKey);


            HttpClientHandler miHttpHandler = new HttpClientHandler();
            miHttpHandler.ClientCertificates.Add(cert);
            miHttpHandler.ClientCertificateOptions = ClientCertificateOption.Manual;
            miHttpHandler.ServerCertificateCustomValidationCallback = ServerCertificateCustomValidation;


            HttpClient httpClient = new(miHttpHandler);

            Uri miUri = new Uri(paramDireccion + ":" + paramPuerto);
            GrpcChannel channel = GrpcChannel.ForAddress(miUri, new GrpcChannelOptions
            {
                HttpClient = httpClient
            });



            _client = new GestorOrdenadores.GestorOrdenadoresClient(channel);
        }
        #endregion constructores

        #region Métodos de inicialización
        private static bool ServerCertificateCustomValidation(HttpRequestMessage requestMessage, X509Certificate2 paramCertificadoServidor, X509Chain chain, SslPolicyErrors sslErrors)
        {
            return true;
        }
        #endregion Métodos de inicialización
    }
```

This is my ASP Core code:

```
using System.Reflection;
using Microsoft.AspNetCore.Server.Kestrel.Core;
using Microsoft.Extensions.Hosting.WindowsServices;
using System.Security.Cryptography.X509Certificates;

using GestorOrdenadores.Service.Server.Grpc;
using Serilog;



Environment.CurrentDirectory = Path.GetDirectoryName(Assembly.GetExecutingAssembly().Location);





Log.Logger = new LoggerConfiguration()
    .WriteTo.Console()
    .CreateBootstrapLogger();

Log.Information("Starting up");




try
{
    WebApplicationOptions options = new WebApplicationOptions
    {
        Args = args,
        ContentRootPath = WindowsServiceHelpers.IsWindowsService() ? AppContext.BaseDirectory : default
    };
    WebApplicationBuilder builder = WebApplication.CreateBuilder(options);



    builder.Host.UseSerilog((ctx, lc) => lc
           .WriteTo.Console()
           .ReadFrom.Configuration(ctx.Configuration));




    builder.WebHost.ConfigureKestrel((context, options) =>
    {
        string miStrCertificado = File.ReadAllText("certificados/server.crt");
        string miStrKey = File.ReadAllText("certificados/server.key");
        X509Certificate2 miCertficadoX509 = X509Certificate2.CreateFromPem(miStrCertificado, miStrKey);

        X509Certificate2 miCertificado2 = new X509Certificate2(miCertficadoX509.Export(X509ContentType.Pkcs12));

        miCertficadoX509.Dispose();

        options.ListenAnyIP(5001, listenOptions =>
        {
            listenOptions.Protocols = HttpProtocols.Http1AndHttp2;
            listenOptions.UseHttps(miCertificado2);
        });
    });


    builder.Services.AddGrpc(opciones =>
    {
        opciones.EnableDetailedErrors = true;
    });
    builder.Host.UseWindowsService();





    WebApplication app = builder.Build();

    app.UseSerilogRequestLogging();

    app.MapGrpcService<GestorOrdenadoresService>();


    app.MapGet("/", () => "Communication with gRPC endpoints must be made through a gRPC client. To learn how to create a client, visit: https://go.microsoft.com/fwlink/?linkid=2086909");



    await app.RunAsync();
}
catch(Exception ex)
{
    Log.Fatal(ex, "Unhandled exception");
}
finally
{
    Log.Information("Shut down complete");
    Log.CloseAndFlush();
}
```

### Expected Behavior

I expect to can connect to the second computer as the same way I can connect to the first computer.

### .NET Version

6.0.400

EDIT: I have tried in a fresh windows 10 installation in a vritual machine and the problem is the same.

Perhaps ASP need some requirements that are satisfy when I install visual studio? Because it is the unique diference that I see, the first computer is the develop computer and the others no.

**Comment by wtgodbe** [comment]
Can you share logs from the client? That would give us more info on why the request was aborted

**Comment by ComptonAlvaro** [comment]
@wtgodbe I will see how to get the log from the android device and I will share it. Just I comment to tell that I don't forget the issue.

**Comment by ComptonAlvaro** [comment]
The log in the client is this:

```
RpcException --> Base -->  = "Status(StatusCode=\"Internal\", Detail=\"Error starting gRPC call. HttpRequestException: The SSL connec…"




RpcException --> Status --> Detail = "Error starting gRPC call. HttpRequestException: The SSL connection could not be established, see inn…"




RpcException --> Status --> DebugException = {System.Net.Http.HttpRequestException}

RpcException --> Status --> DebugException --> Base --> Message = "The SSL connection could not be established, see inner exception."

RpcException --> Status --> DebugException --> Base --> Source = "System.Net.Http"

RpcException --> Status --> DebugException --> Base --> StackTrace = "   at System.Net.Http.ConnectHelper.EstablishSslConnectionAsync(SslClientAuthenticationOptions sslOp…"

RpcException --> Status --> DebugException --> Base --> InnerException = {System.Security.Authentication.AuthenticationException}


RpcException --> Status --> DebugException --> Base --> InnerException = {System.Security.Authentication.AuthenticationException} --> Base --> Message = "Authentication failed, see inner exception."

RpcException --> Status --> DebugException --> Base --> InnerException = {System.Security.Authentication.AuthenticationException} --> Base --> Source = "System.Net.Security"

RpcException --> Status --> DebugException --> Base --> InnerException = {System.Security.Authentication.AuthenticationException} --> Base --> InnerException = {Interop.AndroidCrypto.SslException} -->Base --> Message = "Exception of type 'Interop+AndroidCrypto+SslException' was thrown."

```

**Comment by wtgodbe** [comment]
@JamesNK would you mind taking a look at this one?

**Comment by wtgodbe** [comment]
Also @bartonjs is there any way to produce more detailed logs here?

**Comment by bartonjs** [comment]
Well, the SslException probably had some text in it, but the logger there didn't decide that was interesting.  For explaining how to enable and read SslStream logs, I nominate @wfurt.

**Comment by wfurt** [comment]
I would suggest to get packet capture on the server. It seems like the Android client just aborts. I don't think this is server problem.

**Comment by JamesNK** [comment]
> @JamesNK would you mind taking a look at this one?

The problem is establishing a TLS connection from Android. I don't have any experience here.

**Comment by ComptonAlvaro** [comment]
The odd thing is that I can connect from the same android device to the first computer, the computer that I use to develop the solution, but i can connect to anohter computers where I run the ASP application.

My first thought was about the TLS connection too, but if I use the same certificates, why can I connect to one server and not to anothers? Because I have created a certificate for the server which common name is "localhost" and it works too, because I can connect to all computers from a WPF application.

So I am a bit lose.

**Comment by ComptonAlvaro** [comment]
This is the log of wireshark in the server that has the problem:

The android device has the IP: 192.168.1.131 and the server the IP 192.168.1.145.

```
No.     Time           Source                Destination           Protocol Length Info
     18 5.950741       192.168.1.131         239.255.255.250       SSDP     169    M-SEARCH * HTTP/1.1 

Frame 18: 169 bytes on wire (1352 bits), 169 bytes captured (1352 bits) on interface \Device\NPF_{AA63C778-9B84-4CE8-AECB-D80C4B97EAB5}, id 0
Ethernet II, Src: XiaomiCo_cb:34:52 (a4:55:90:cb:34:52), Dst: IPv4mcast_7f:ff:fa (01:00:5e:7f:ff:fa)
Internet Protocol Version 4, Src: 192.168.1.131, Dst: 239.255.255.250
User Datagram Protocol, Src Port: 51050, Dst Port: 1900
Simple Service Discovery Protocol

No.     Time           Source                Destination           Protocol Length Info
     22 6.986832       192.168.1.131         239.255.255.250       SSDP     169    M-SEARCH * HTTP/1.1 

Frame 22: 169 bytes on wire (1352 bits), 169 bytes captured (1352 bits) on interface \Device\NPF_{AA63C778-9B84-4CE8-AECB-D80C4B97EAB5}, id 0
Ethernet II, Src: XiaomiCo_cb:34:52 (a4:55:90:cb:34:52), Dst: IPv4mcast_7f:ff:fa (01:00:5e:7f:ff:fa)
Internet Protocol Version 4, Src: 192.168.1.131, Dst: 239.255.255.250
User Datagram Protocol, Src Port: 51050, Dst Port: 1900
Simple Service Discovery Protocol

No.     Time           Source                Destination           Protocol Length Info
     23 8.010618       192.168.1.131         239.255.255.250       SSDP     169    M-SEARCH * HTTP/1.1 

Frame 23: 169 bytes on wire (1352 bits), 169 bytes captured (1352 bits) on interface \Device\NPF_{AA63C778-9B84-4CE8-AECB-D80C4B97EAB5}, id 0
Ethernet II, Src: XiaomiCo_cb:34:52 (a4:55:90:cb:34:52), Dst: IPv4mcast_7f:ff:fa (01:00:5e:7f:ff:fa)
Internet Protocol Version 4, Src: 192.168.1.131, Dst: 239.255.255.250
User Datagram Protocol, Src Port: 51050, Dst Port: 1900
Simple Service Discovery Protocol

No.     Time           Source                Destination           Protocol Length Info
     24 9.046231       192.168.1.131         239.255.255.250       SSDP     169    M-SEARCH * HTTP/1.1 

Frame 24: 169 bytes on wire (1352 bits), 169 bytes captured (1352 bits) on interface \Device\NPF_{AA63C778-9B84-4CE8-AECB-D80C4B97EAB5}, id 0
Ethernet II, Src: XiaomiCo_cb:34:52 (a4:55:90:cb:34:52), Dst: IPv4mcast_7f:ff:fa (01:00:5e:7f:ff:fa)
Internet Protocol Version 4, Src: 192.168.1.131, Dst: 239.255.255.250
User Datagram Protocol, Src Port: 51050, Dst Port: 1900
Simple Service Discovery Protocol

No.     Time           Source                Destination           Protocol Length Info
     27 10.091412      192.168.1.131         239.255.255.250       SSDP     169    M-SEARCH * HTTP/1.1 

Frame 27: 169 bytes on wire (1352 bits), 169 bytes captured (1352 bits) on interface \Device\NPF_{AA63C778-9B84-4CE8-AECB-D80C4B97EAB5}, id 0
Ethernet II, Src: XiaomiCo_cb:34:52 (a4:55:90:cb:34:52), Dst: IPv4mcast_7f:ff:fa (01:00:5e:7f:ff:fa)
Internet Protocol Version 4, Src: 192.168.1.131, Dst: 239.255.255.250
User Datagram Protocol, Src Port: 51050, Dst Port: 1900
Simple Service Discovery Protocol

No.     Time           Source                Destination           Protocol Length Info
     31 11.121700      192.168.1.131         239.255.255.250       SSDP     169    M-SEARCH * HTTP/1.1 

Frame 31: 169 bytes on wire (1352 bits), 169 bytes captured (1352 bits) on interface \Device\NPF_{AA63C778-9B84-4CE8-AECB-D80C4B97EAB5}, id 0
Ethernet II, Src: XiaomiCo_cb:34:52 (a4:55:90:cb:34:52), Dst: IPv4mcast_7f:ff:fa (01:00:5e:7f:ff:fa)
Internet Protocol Version 4, Src: 192.168.1.131, Dst: 239.255.255.250
User Datagram Protocol, Src Port: 51050, Dst Port: 1900
Simple Service Discovery Protocol

No.     Time           Source                Destination           Protocol Length Info
   1046 22.843494      192.168.1.131         239.255.255.250       SSDP     169    M-SEARCH * HTTP/1.1 

Frame 1046: 169 bytes on wire (1352 bits), 169 bytes captured (1352 bits) on interface \Device\NPF_{AA63C778-9B84-4CE8-AECB-D80C4B97EAB5}, id 0
Ethernet II, Src: XiaomiCo_cb:34:52 (a4:55:90:cb:34:52), Dst: IPv4mcast_7f:ff:fa (01:00:5e:7f:ff:fa)
Internet Protocol Version 4, Src: 192.168.1.131, Dst: 239.255.255.250
User Datagram Protocol, Src Port: 51050, Dst Port: 1900
Simple Service Discovery Protocol

No.     Time           Source                Destination           Protocol Length Info
   1801 23.858387      192.168.1.131         239.255.255.250       SSDP     169    M-SEARCH * HTTP/1.1 

Frame 1801: 169 bytes on wire (1352 bits), 169 bytes captured (1352 bits) on interface \Device\NPF_{AA63C778-9B84-4CE8-AECB-D80C4B97EAB5}, id 0
Ethernet II, Src: XiaomiCo_cb:34:52 (a4:55:90:cb:34:52), Dst: IPv4mcast_7f:ff:fa (01:00:5e:7f:ff:fa)
Internet Protocol Version 4, Src: 192.168.1.131, Dst: 239.255.255.250
User Datagram Protocol, Src Port: 51050, Dst Port: 1900
Simple Service Discovery Protocol

No.     Time           Source                Destination           Protocol Length Info
   1912 24.894095      192.168.1.131         239.255.255.250       SSDP     169    M-SEARCH * HTTP/1.1 

Frame 1912: 169 bytes on wire (1352 bits), 169 bytes captured (1352 bits) on interface \Device\NPF_{AA63C778-9B84-4CE8-AECB-D80C4B97EAB5}, id 0
Ethernet II, Src: XiaomiCo_cb:34:52 (a4:55:90:cb:34:52), Dst: IPv4mcast_7f:ff:fa (01:00:5e:7f:ff:fa)
Internet Protocol Version 4, Src: 192.168.1.131, Dst: 239.255.255.250
User Datagram Protocol, Src Port: 51050, Dst Port: 1900
Simple Service Discovery Protocol

No.     Time           Source                Destination           Protocol Length Info
   1917 25.918537      192.168.1.131         239.255.255.250       SSDP     169    M-SEARCH * HTTP/1.1 

Frame 1917: 169 bytes on wire (1352 bits), 169 bytes captured (1352 bits) on interface \Device\NPF_{AA63C778-9B84-4CE8-AECB-D80C4B97EAB5}, id 0
Ethernet II, Src: XiaomiCo_cb:34:52 (a4:55:90:cb:34:52), Dst: IPv4mcast_7f:ff:fa (01:00:5e:7f:ff:fa)
Internet Protocol Version 4, Src: 192.168.1.131, Dst: 239.255.255.250
User Datagram Protocol, Src Port: 51050, Dst Port: 1900
Simple Service Discovery Protocol

No.     Time           Source                Destination           Protocol Length Info
   1926 26.957253      192.168.1.131         239.255.255.250       SSDP     169    M-SEARCH * HTTP/1.1 

Frame 1926: 169 bytes on wire (1352 bits), 169 bytes captured (1352 bits) on interface \Device\NPF_{AA63C778-9B84-4CE8-AECB-D80C4B97EAB5}, id 0
Ethernet II, Src: XiaomiCo_cb:34:52 (a4:55:90:cb:34:52), Dst: IPv4mcast_7f:ff:fa (01:00:5e:7f:ff:fa)
Internet Protocol Version 4, Src: 192.168.1.131, Dst: 239.255.255.250
User Datagram Protocol, Src Port: 51050, Dst Port: 1900
Simple Service Discovery Protocol

No.     Time           Source                Destination           Protocol Length Info
   1932 27.974931      192.168.1.131         239.255.255.250       SSDP     169    M-SEARCH * HTTP/1.1 

Frame 1932: 169 bytes on wire (1352 bits), 169 bytes captured (1352 bits) on interface \Device\NPF_{AA63C778-9B84-4CE8-AECB-D80C4B97EAB5}, id 0
Ethernet II, Src: XiaomiCo_cb:34:52 (a4:55:90:cb:34:52), Dst: IPv4mcast_7f:ff:fa (01:00:5e:7f:ff:fa)
Internet Protocol Version 4, Src: 192.168.1.131, Dst: 239.255.255.250
User Datagram Protocol, Src Port: 51050, Dst Port: 1900
Simple Service Discovery Protocol

No.     Time           Source                Destination           Protocol Length Info
   2091 33.872892      192.168.1.131         224.0.0.251           MDNS     136    Standard query 0x0001 PTR _%9E5E7C8F47989526C9BCD95D24084F6F0B27C5ED._sub._googlecast._tcp.local, "QU" question PTR _googlecast._tcp.local, "QU" question

Frame 2091: 136 bytes on wire (1088 bits), 136 bytes captured (1088 bits) on interface \Device\NPF_{AA63C778-9B84-4CE8-AECB-D80C4B97EAB5}, id 0
Ethernet II, Src: XiaomiCo_cb:34:52 (a4:55:90:cb:34:52), Dst: IPv4mcast_fb (01:00:5e:00:00:fb)
Internet Protocol Version 4, Src: 192.168.1.131, Dst: 224.0.0.251
User Datagram Protocol, Src Port: 5353, Dst Port: 5353
Multicast Domain Name System (query)

No.     Time           Source                Destination           Protocol Length Info
   2092 33.876514      192.168.1.131         224.0.0.251           MDNS     136    Standard query 0x0001 PTR _%9E5E7C8F47989526C9BCD95D24084F6F0B27C5ED._sub._googlecast._tcp.local, "QU" question PTR _googlecast._tcp.local, "QU" question

Frame 2092: 136 bytes on wire (1088 bits), 136 bytes captured (1088 bits) on interface \Device\NPF_{AA63C778-9B84-4CE8-AECB-D80C4B97EAB5}, id 0
Ethernet II, Src: XiaomiCo_cb:34:52 (a4:55:90:cb:34:52), Dst: IPv4mcast_fb (01:00:5e:00:00:fb)
Internet Protocol Version 4, Src: 192.168.1.131, Dst: 224.0.0.251
User Datagram Protocol, Src Port: 5353, Dst Port: 5353
Multicast Domain Name System (query)

No.     Time           Source                Destination           Protocol Length Info
   2120 34.597793      192.168.1.131         224.0.0.251           MDNS     280    Standard query 0x0000 ANY Android.local, "QM" question ANY Android.local, "QM" question ANY Android.local, "QM" question ANY Android.local, "QM" question ANY {"nm":"POCO X3 Pro","as":"[8194]","ip":"131"}._mi-connect._udp.local, "QM" question A 192.168.1.131 AAAA fe80::121f:4265:a44e:f48d AAAA 2a0c:5a80:1e05:9b00:d0a:1565:4a6:b84 AAAA 2a0c:5a80:1e05:9b00:4934:a536:fd22:142d SRV 0 0 56666 Android.local

Frame 2120: 280 bytes on wire (2240 bits), 280 bytes captured (2240 bits) on interface \Device\NPF_{AA63C778-9B84-4CE8-AECB-D80C4B97EAB5}, id 0
Ethernet II, Src: XiaomiCo_cb:34:52 (a4:55:90:cb:34:52), Dst: IPv4mcast_fb (01:00:5e:00:00:fb)
Internet Protocol Version 4, Src: 192.168.1.131, Dst: 224.0.0.251
User Datagram Protocol, Src Port: 5353, Dst Port: 5353
Multicast Domain Name System (query)

No.     Time           Source                Destination           Protocol Length Info
   2122 34.834914      192.168.1.131         224.0.0.251           MDNS     280    Standard query 0x0000 ANY Android.local, "QM" question ANY Android.local, "QM" question ANY Android.local, "QM" question ANY Android.local, "QM" question ANY {"nm":"POCO X3 Pro","as":"[8194]","ip":"131"}._mi-connect._udp.local, "QM" question A 192.168.1.131 AAAA fe80::121f:4265:a44e:f48d AAAA 2a0c:5a80:1e05:9b00:d0a:1565:4a6:b84 AAAA 2a0c:5a80:1e05:9b00:4934:a536:fd22:142d SRV 0 0 56666 Android.local

Frame 2122: 280 bytes on wire (2240 bits), 280 bytes captured (2240 bits) on interface \Device\NPF_{AA63C778-9B84-4CE8-AECB-D80C4B97EAB5}, id 0
Ethernet II, Src: XiaomiCo_cb:34:52 (a4:55:90:cb:34:52), Dst: IPv4mcast_fb (01:00:5e:00:00:fb)
Internet Protocol Version 4, Src: 192.168.1.131, Dst: 224.0.0.251
User Datagram Protocol, Src Port: 5353, Dst Port: 5353
Multicast Domain Name System (query)

No.     Time           Source                Destination           Protocol Length Info
   2124 34.879990      192.168.1.131         224.0.0.251           MDNS     136    Standard query 0x0002 PTR _%9E5E7C8F47989526C9BCD95D24084F6F0B27C5ED._sub._googlecast._tcp.local, "QM" question PTR _googlecast._tcp.local, "QM" question

Frame 2124: 136 bytes on wire (1088 bits), 136 bytes captured (1088 bits) on interface \Device\NPF_{AA63C778-9B84-4CE8-AECB-D80C4B97EAB5}, id 0
Ethernet II, Src: XiaomiCo_cb:34:52 (a4:55:90:cb:34:52), Dst: IPv4mcast_fb (01:00:5e:00:00:fb)
Internet Protocol Version 4, Src: 192.168.1.131, Dst: 224.0.0.251
User Datagram Protocol, Src Port: 5353, Dst Port: 5353
Multicast Domain Name System (query)

No.     Time           Source                Destination           Protocol Length Info
   2127 35.088860      192.168.1.131         224.0.0.251           MDNS     280    Standard query 0x0000 ANY Android.local, "QM" question ANY Android.local, "QM" question ANY Android.local, "QM" question ANY Android.local, "QM" question ANY {"nm":"POCO X3 Pro","as":"[8194]","ip":"131"}._mi-connect._udp.local, "QM" question A 192.168.1.131 AAAA fe80::121f:4265:a44e:f48d AAAA 2a0c:5a80:1e05:9b00:d0a:1565:4a6:b84 AAAA 2a0c:5a80:1e05:9b00:4934:a536:fd22:142d SRV 0 0 56666 Android.local

Frame 2127: 280 bytes on wire (2240 bits), 280 bytes captured (2240 bits) on interface \Device\NPF_{AA63C778-9B84-4CE8-AECB-D80C4B97EAB5}, id 0
Ethernet II, Src: XiaomiCo_cb:34:52 (a4:55:90:cb:34:52), Dst: IPv4mcast_fb (01:00:5e:00:00:fb)
Internet Protocol Version 4, Src: 192.168.1.131, Dst: 224.0.0.251
User Datagram Protocol, Src Port: 5353, Dst Port: 5353
Multicast Domain Name System (query)

No.     Time           Source                Destination           Protocol Length Info
   2129 35.340575      192.168.1.131         224.0.0.251           MDNS     779    Standard query response 0x0000 PTR, cache flush Android.local PTR, cache flush Android.local PTR, cache flush Android.local PTR, cache flush Android.local TXT, cache flush PTR _mi-connect._udp.local PTR {"nm":"POCO X3 Pro","as":"[8194]","ip":"131"}._mi-connect._udp.local A, cache flush 192.168.1.131 AAAA, cache flush fe80::121f:4265:a44e:f48d AAAA, cache flush 2a0c:5a80:1e05:9b00:d0a:1565:4a6:b84 AAAA, cache flush 2a0c:5a80:1e05:9b00:4934:a536:fd22:142d SRV, cache flush 0 0 56666 Android.local NSEC, cache flush 131.1.168.192.in-addr.arpa NSEC, cache flush D.8.4.F.E.4.4.A.5.6.2.4.F.1.2.1.0.0.0.0.0.0.0.0.0.0.0.0.0.8.E.F.ip6.arpa NSEC, cache flush 4.8.B.0.6.A.4.0.5.6.5.1.A.0.D.0.0.0.B.9.5.0.E.1.0.8.A.5.C.0.A.2.ip6.arpa NSEC, cache flush D.2.4.1.2.2.D.F.6.3.5.A.4.3.9.4.0.0.B.9.5.0.E.1.0.8.A.5.C.0.A.2.ip6.arpa NSEC, cache flush {"nm":"POCO X3 Pro","as":"[8194]","ip":"131"}._mi-connect._udp.local NSEC, cache flush Android.local

Frame 2129: 779 bytes on wire (6232 bits), 779 bytes captured (6232 bits) on interface \Device\NPF_{AA63C778-9B84-4CE8-AECB-D80C4B97EAB5}, id 0
Ethernet II, Src: XiaomiCo_cb:34:52 (a4:55:90:cb:34:52), Dst: IPv4mcast_fb (01:00:5e:00:00:fb)
Internet Protocol Version 4, Src: 192.168.1.131, Dst: 224.0.0.251
User Datagram Protocol, Src Port: 5353, Dst Port: 5353
Multicast Domain Name System (response)

No.     Time           Source                Destination           Protocol Length Info
   2133 35.905243      192.168.1.131         224.0.0.251           MDNS     136    Standard query 0x0003 PTR _%9E5E7C8F47989526C9BCD95D24084F6F0B27C5ED._sub._googlecast._tcp.local, "QM" question PTR _googlecast._tcp.local, "QM" question

Frame 2133: 136 bytes on wire (1088 bits), 136 bytes captured (1088 bits) on interface \Device\NPF_{AA63C778-9B84-4CE8-AECB-D80C4B97EAB5}, id 0
Ethernet II, Src: XiaomiCo_cb:34:52 (a4:55:90:cb:34:52), Dst: IPv4mcast_fb (01:00:5e:00:00:fb)
Internet Protocol Version 4, Src: 192.168.1.131, Dst: 224.0.0.251
User Datagram Protocol, Src Port: 5353, Dst Port: 5353
Multicast Domain Name System (query)

No.     Time           Source                Destination           Protocol Length Info
   2136 36.328601      192.168.1.131         224.0.0.251           MDNS     779    Standard query response 0x0000 PTR, cache flush Android.local PTR, cache flush Android.local PTR, cache flush Android.local PTR, cache flush Android.local TXT, cache flush PTR _mi-connect._udp.local PTR {"nm":"POCO X3 Pro","as":"[8194]","ip":"131"}._mi-connect._udp.local A, cache flush 192.168.1.131 AAAA, cache flush fe80::121f:4265:a44e:f48d AAAA, cache flush 2a0c:5a80:1e05:9b00:d0a:1565:4a6:b84 AAAA, cache flush 2a0c:5a80:1e05:9b00:4934:a536:fd22:142d SRV, cache flush 0 0 56666 Android.local NSEC, cache flush 131.1.168.192.in-addr.arpa NSEC, cache flush D.8.4.F.E.4.4.A.5.6.2.4.F.1.2.1.0.0.0.0.0.0.0.0.0.0.0.0.0.8.E.F.ip6.arpa NSEC, cache flush 4.8.B.0.6.A.4.0.5.6.5.1.A.0.D.0.0.0.B.9.5.0.E.1.0.8.A.5.C.0.A.2.ip6.arpa NSEC, cache flush D.2.4.1.2.2.D.F.6.3.5.A.4.3.9.4.0.0.B.9.5.0.E.1.0.8.A.5.C.0.A.2.ip6.arpa NSEC, cache flush {"nm":"POCO X3 Pro","as":"[8194]","ip":"131"}._mi-connect._udp.local NSEC, cache flush Android.local

Frame 2136: 779 bytes on wire (6232 bits), 779 bytes captured (6232 bits) on interface \Device\NPF_{AA63C778-9B84-4CE8-AECB-D80C4B97EAB5}, id 0
Ethernet II, Src: XiaomiCo_cb:34:52 (a4:55:90:cb:34:52), Dst: IPv4mcast_fb (01:00:5e:00:00:fb)
Internet Protocol Version 4, Src: 192.168.1.131, Dst: 224.0.0.251
User Datagram Protocol, Src Port: 5353, Dst Port: 5353
Multicast Domain Name System (response)

No.     Time           Source                Destination           Protocol Length Info
   2151 38.344148      192.168.1.131         224.0.0.251           MDNS     779    Standard query response 0x0000 PTR, cache flush Android.local PTR, cache flush Android.local PTR, cache flush Android.local PTR, cache flush Android.local TXT, cache flush PTR _mi-connect._udp.local PTR {"nm":"POCO X3 Pro","as":"[8194]","ip":"131"}._mi-connect._udp.local A, cache flush 192.168.1.131 AAAA, cache flush fe80::121f:4265:a44e:f48d AAAA, cache flush 2a0c:5a80:1e05:9b00:d0a:1565:4a6:b84 AAAA, cache flush 2a0c:5a80:1e05:9b00:4934:a536:fd22:142d SRV, cache flush 0 0 56666 Android.local NSEC, cache flush 131.1.168.192.in-addr.arpa NSEC, cache flush D.8.4.F.E.4.4.A.5.6.2.4.F.1.2.1.0.0.0.0.0.0.0.0.0.0.0.0.0.8.E.F.ip6.arpa NSEC, cache flush 4.8.B.0.6.A.4.0.5.6.5.1.A.0.D.0.0.0.B.9.5.0.E.1.0.8.A.5.C.0.A.2.ip6.arpa NSEC, cache flush D.2.4.1.2.2.D.F.6.3.5.A.4.3.9.4.0.0.B.9.5.0.E.1.0.8.A.5.C.0.A.2.ip6.arpa NSEC, cache flush {"nm":"POCO X3 Pro","as":"[8194]","ip":"131"}._mi-connect._udp.local NSEC, cache flush Android.local

Frame 2151: 779 bytes on wire (6232 bits), 779 bytes captured (6232 bits) on interface \Device\NPF_{AA63C778-9B84-4CE8-AECB-D80C4B97EAB5}, id 0
Ethernet II, Src: XiaomiCo_cb:34:52 (a4:55:90:cb:34:52), Dst: IPv4mcast_fb (01:00:5e:00:00:fb)
Internet Protocol Version 4, Src: 192.168.1.131, Dst: 224.0.0.251
User Datagram Protocol, Src Port: 5353, Dst Port: 5353
Multicast Domain Name System (response)

No.     Time           Source                Destination           Protocol Length Info
   2154 39.374814      192.168.1.131         239.255.255.250       SSDP     169    M-SEARCH * HTTP/1.1 

Frame 2154: 169 bytes on wire (1352 bits), 169 bytes captured (1352 bits) on interface \Device\NPF_{AA63C778-9B84-4CE8-AECB-D80C4B97EAB5}, id 0
Ethernet II, Src: XiaomiCo_cb:34:52 (a4:55:90:cb:34:52), Dst: IPv4mcast_7f:ff:fa (01:00:5e:7f:ff:fa)
Internet Protocol Version 4, Src: 192.168.1.131, Dst: 239.255.255.250
User Datagram Protocol, Src Port: 51050, Dst Port: 1900
Simple Service Discovery Protocol

No.     Time           Source                Destination           Protocol Length Info
   2155 40.434263      192.168.1.131         239.255.255.250       SSDP     169    M-SEARCH * HTTP/1.1 

Frame 2155: 169 bytes on wire (1352 bits), 169 bytes captured (1352 bits) on interface \Device\NPF_{AA63C778-9B84-4CE8-AECB-D80C4B97EAB5}, id 0
Ethernet II, Src: XiaomiCo_cb:34:52 (a4:55:90:cb:34:52), Dst: IPv4mcast_7f:ff:fa (01:00:5e:7f:ff:fa)
Internet Protocol Version 4, Src: 192.168.1.131, Dst: 239.255.255.250
User Datagram Protocol, Src Port: 51050, Dst Port: 1900
Simple Service Discovery Protocol

No.     Time           Source                Destination           Protocol Length Info
   2161 41.508994      192.168.1.131         239.255.255.250       SSDP     169    M-SEARCH * HTTP/1.1 

Frame 2161: 169 bytes on wire (1352 bits), 169 bytes captured (1352 bits) on interface \Device\NPF_{AA63C778-9B84-4CE8-AECB-D80C4B97EAB5}, id 0
Ethernet II, Src: XiaomiCo_cb:34:52 (a4:55:90:cb:34:52), Dst: IPv4mcast_7f:ff:fa (01:00:5e:7f:ff:fa)
Internet Protocol Version 4, Src: 192.168.1.131, Dst: 239.255.255.250
User Datagram Protocol, Src Port: 51050, Dst Port: 1900
Simple Service Discovery Protocol

No.     Time           Source                Destination           Protocol Length Info
   2164 42.343714      192.168.1.131         224.0.0.251           MDNS     779    Standard query response 0x0000 PTR, cache flush Android.local PTR, cache flush Android.local PTR, cache flush Android.local PTR, cache flush Android.local TXT, cache flush PTR _mi-connect._udp.local PTR {"nm":"POCO X3 Pro","as":"[8194]","ip":"131"}._mi-connect._udp.local A, cache flush 192.168.1.131 AAAA, cache flush fe80::121f:4265:a44e:f48d AAAA, cache flush 2a0c:5a80:1e05:9b00:d0a:1565:4a6:b84 AAAA, cache flush 2a0c:5a80:1e05:9b00:4934:a536:fd22:142d SRV, cache flush 0 0 56666 Android.local NSEC, cache flush 131.1.168.192.in-addr.arpa NSEC, cache flush D.8.4.F.E.4.4.A.5.6.2.4.F.1.2.1.0.0.0.0.0.0.0.0.0.0.0.0.0.8.E.F.ip6.arpa NSEC, cache flush 4.8.B.0.6.A.4.0.5.6.5.1.A.0.D.0.0.0.B.9.5.0.E.1.0.8.A.5.C.0.A.2.ip6.arpa NSEC, cache flush D.2.4.1.2.2.D.F.6.3.5.A.4.3.9.4.0.0.B.9.5.0.E.1.0.8.A.5.C.0.A.2.ip6.arpa NSEC, cache flush {"nm":"POCO X3 Pro","as":"[8194]","ip":"131"}._mi-connect._udp.local NSEC, cache flush Android.local

Frame 2164: 779 bytes on wire (6232 bits), 779 bytes captured (6232 bits) on interface \Device\NPF_{AA63C778-9B84-4CE8-AECB-D80C4B97EAB5}, id 0
Ethernet II, Src: XiaomiCo_cb:34:52 (a4:55:90:cb:34:52), Dst: IPv4mcast_fb (01:00:5e:00:00:fb)
Internet Protocol Version 4, Src: 192.168.1.131, Dst: 224.0.0.251
User Datagram Protocol, Src Port: 5353, Dst Port: 5353
Multicast Domain Name System (response)

No.     Time           Source                Destination           Protocol Length Info
   2166 42.566168      192.168.1.131         239.255.255.250       SSDP     169    M-SEARCH * HTTP/1.1 

Frame 2166: 169 bytes on wire (1352 bits), 169 bytes captured (1352 bits) on interface \Device\NPF_{AA63C778-9B84-4CE8-AECB-D80C4B97EAB5}, id 0
Ethernet II, Src: XiaomiCo_cb:34:52 (a4:55:90:cb:34:52), Dst: IPv4mcast_7f:ff:fa (01:00:5e:7f:ff:fa)
Internet Protocol Version 4, Src: 192.168.1.131, Dst: 239.255.255.250
User Datagram Protocol, Src Port: 51050, Dst Port: 1900
Simple Service Discovery Protocol

No.     Time           Source                Destination           Protocol Length Info
   2167 43.627160      192.168.1.131         239.255.255.250       SSDP     169    M-SEARCH * HTTP/1.1 

Frame 2167: 169 bytes on wire (1352 bits), 169 bytes captured (1352 bits) on interface \Device\NPF_{AA63C778-9B84-4CE8-AECB-D80C4B97EAB5}, id 0
Ethernet II, Src: XiaomiCo_cb:34:52 (a4:55:90:cb:34:52), Dst: IPv4mcast_7f:ff:fa (01:00:5e:7f:ff:fa)
Internet Protocol Version 4, Src: 192.168.1.131, Dst: 239.255.255.250
User Datagram Protocol, Src Port: 51050, Dst Port: 1900
Simple Service Discovery Protocol

No.     Time           Source                Destination           Protocol Length Info
   2168 44.687236      192.168.1.131         239.255.255.250       SSDP     169    M-SEARCH * HTTP/1.1 

Frame 2168: 169 bytes on wire (1352 bits), 169 bytes captured (1352 bits) on interface \Device\NPF_{AA63C778-9B84-4CE8-AECB-D80C4B97EAB5}, id 0
Ethernet II, Src: XiaomiCo_cb:34:52 (a4:55:90:cb:34:52), Dst: IPv4mcast_7f:ff:fa (01:00:5e:7f:ff:fa)
Internet Protocol Version 4, Src: 192.168.1.131, Dst: 239.255.255.250
User Datagram Protocol, Src Port: 51050, Dst Port: 1900
Simple Service Discovery Protocol

No.     Time           Source                Destination           Protocol Length Info
   2176 46.784321      192.168.1.131         192.168.1.145         TCP      74     45594 → 5001 [SYN] Seq=0 Win=65535 Len=0 MSS=1460 SACK_PERM=1 TSval=1203348356 TSecr=0 WS=512

Frame 2176: 74 bytes on wire (592 bits), 74 bytes captured (592 bits) on interface \Device\NPF_{AA63C778-9B84-4CE8-AECB-D80C4B97EAB5}, id 0
Ethernet II, Src: XiaomiCo_cb:34:52 (a4:55:90:cb:34:52), Dst: PcsCompu_e2:dc:77 (08:00:27:e2:dc:77)
Internet Protocol Version 4, Src: 192.168.1.131, Dst: 192.168.1.145
Transmission Control Protocol, Src Port: 45594, Dst Port: 5001, Seq: 0, Len: 0

No.     Time           Source                Destination           Protocol Length Info
   2179 46.893877      192.168.1.145         192.168.1.131         TCP      66     5001 → 45594 [SYN, ACK] Seq=0 Ack=1 Win=65535 Len=0 MSS=1460 WS=256 SACK_PERM=1

Frame 2179: 66 bytes on wire (528 bits), 66 bytes captured (528 bits) on interface \Device\NPF_{AA63C778-9B84-4CE8-AECB-D80C4B97EAB5}, id 0
Ethernet II, Src: PcsCompu_e2:dc:77 (08:00:27:e2:dc:77), Dst: XiaomiCo_cb:34:52 (a4:55:90:cb:34:52)
Internet Protocol Version 4, Src: 192.168.1.145, Dst: 192.168.1.131
Transmission Control Protocol, Src Port: 5001, Dst Port: 45594, Seq: 0, Ack: 1, Len: 0

No.     Time           Source                Destination           Protocol Length Info
   2180 47.797575      192.168.1.131         192.168.1.145         TCP      74     [TCP Retransmission] [TCP Port numbers reused] 45594 → 5001 [SYN] Seq=0 Win=65535 Len=0 MSS=1460 SACK_PERM=1 TSval=1203349376 TSecr=0 WS=512

Frame 2180: 74 bytes on wire (592 bits), 74 bytes captured (592 bits) on interface \Device\NPF_{AA63C778-9B84-4CE8-AECB-D80C4B97EAB5}, id 0
Ethernet II, Src: XiaomiCo_cb:34:52 (a4:55:90:cb:34:52), Dst: PcsCompu_e2:dc:77 (08:00:27:e2:dc:77)
Internet Protocol Version 4, Src: 192.168.1.131, Dst: 192.168.1.145
Transmission Control Protocol, Src Port: 45594, Dst Port: 5001, Seq: 0, Len: 0

No.     Time           Source                Destination           Protocol Length Info
   2181 47.801488      192.168.1.145         192.168.1.131         TCP      66     [TCP Retransmission] 5001 → 45594 [SYN, ACK] Seq=0 Ack=1 Win=65535 Len=0 MSS=1460 WS=256 SACK_PERM=1

Frame 2181: 66 bytes on wire (528 bits), 66 bytes captured (528 bits) on interface \Device\NPF_{AA63C778-9B84-4CE8-AECB-D80C4B97EAB5}, id 0
Ethernet II, Src: PcsCompu_e2:dc:77 (08:00:27:e2:dc:77), Dst: XiaomiCo_cb:34:52 (a4:55:90:cb:34:52)
Internet Protocol Version 4, Src: 192.168.1.145, Dst: 192.168.1.131
Transmission Control Protocol, Src Port: 5001, Dst Port: 45594, Seq: 0, Ack: 1, Len: 0

No.     Time           Source                Destination           Protocol Length Info
   2182 47.806925      192.168.1.131         192.168.1.145         TCP      60     45594 → 5001 [ACK] Seq=1 Ack=1 Win=88064 Len=0

Frame 2182: 60 bytes on wire (480 bits), 60 bytes captured (480 bits) on interface \Device\NPF_{AA63C778-9B84-4CE8-AECB-D80C4B97EAB5}, id 0
Ethernet II, Src: XiaomiCo_cb:34:52 (a4:55:90:cb:34:52), Dst: PcsCompu_e2:dc:77 (08:00:27:e2:dc:77)
Internet Protocol Version 4, Src: 192.168.1.131, Dst: 192.168.1.145
Transmission Control Protocol, Src Port: 45594, Dst Port: 5001, Seq: 1, Ack: 1, Len: 0

No.     Time           Source                Destination           Protocol Length Info
   2188 48.729742      192.168.1.131         192.168.1.145         TLSv1.2  300    Client Hello

Frame 2188: 300 bytes on wire (2400 bits), 300 bytes captured (2400 bits) on interface \Device\NPF_{AA63C778-9B84-4CE8-AECB-D80C4B97EAB5}, id 0
Ethernet II, Src: XiaomiCo_cb:34:52 (a4:55:90:cb:34:52), Dst: PcsCompu_e2:dc:77 (08:00:27:e2:dc:77)
Internet Protocol Version 4, Src: 192.168.1.131, Dst: 192.168.1.145
Transmission Control Protocol, Src Port: 45594, Dst Port: 5001, Seq: 1, Ack: 1, Len: 246
Transport Layer Security

No.     Time           Source                Destination           Protocol Length Info
   2189 48.775727      192.168.1.145         192.168.1.131         TCP      54     5001 → 45594 [ACK] Seq=1 Ack=247 Win=262400 Len=0

Frame 2189: 54 bytes on wire (432 bits), 54 bytes captured (432 bits) on interface \Device\NPF_{AA63C778-9B84-4CE8-AECB-D80C4B97EAB5}, id 0
Ethernet II, Src: PcsCompu_e2:dc:77 (08:00:27:e2:dc:77), Dst: XiaomiCo_cb:34:52 (a4:55:90:cb:34:52)
Internet Protocol Version 4, Src: 192.168.1.145, Dst: 192.168.1.131
Transmission Control Protocol, Src Port: 5001, Dst Port: 45594, Seq: 1, Ack: 247, Len: 0

No.     Time           Source                Destination           Protocol Length Info
   2190 48.839687      192.168.1.145         192.168.1.131         TLSv1.2  1406   Server Hello, Certificate, Server Key Exchange, Server Hello Done

Frame 2190: 1406 bytes on wire (11248 bits), 1406 bytes captured (11248 bits) on interface \Device\NPF_{AA63C778-9B84-4CE8-AECB-D80C4B97EAB5}, id 0
Ethernet II, Src: PcsCompu_e2:dc:77 (08:00:27:e2:dc:77), Dst: XiaomiCo_cb:34:52 (a4:55:90:cb:34:52)
Internet Protocol Version 4, Src: 192.168.1.145, Dst: 192.168.1.131
Transmission Control Protocol, Src Port: 5001, Dst Port: 45594, Seq: 1, Ack: 247, Len: 1352
Transport Layer Security

No.     Time           Source                Destination           Protocol Length Info
   2192 50.354612      192.168.1.131         224.0.0.251           MDNS     779    Standard query response 0x0000 PTR, cache flush Android.local PTR, cache flush Android.local PTR, cache flush Android.local PTR, cache flush Android.local TXT, cache flush PTR _mi-connect._udp.local PTR {"nm":"POCO X3 Pro","as":"[8194]","ip":"131"}._mi-connect._udp.local A, cache flush 192.168.1.131 AAAA, cache flush fe80::121f:4265:a44e:f48d AAAA, cache flush 2a0c:5a80:1e05:9b00:d0a:1565:4a6:b84 AAAA, cache flush 2a0c:5a80:1e05:9b00:4934:a536:fd22:142d SRV, cache flush 0 0 56666 Android.local NSEC, cache flush 131.1.168.192.in-addr.arpa NSEC, cache flush D.8.4.F.E.4.4.A.5.6.2.4.F.1.2.1.0.0.0.0.0.0.0.0.0.0.0.0.0.8.E.F.ip6.arpa NSEC, cache flush 4.8.B.0.6.A.4.0.5.6.5.1.A.0.D.0.0.0.B.9.5.0.E.1.0.8.A.5.C.0.A.2.ip6.arpa NSEC, cache flush D.2.4.1.2.2.D.F.6.3.5.A.4.3.9.4.0.0.B.9.5.0.E.1.0.8.A.5.C.0.A.2.ip6.arpa NSEC, cache flush {"nm":"POCO X3 Pro","as":"[8194]","ip":"131"}._mi-connect._udp.local NSEC, cache flush Android.local

Frame 2192: 779 bytes on wire (6232 bits), 779 bytes captured (6232 bits) on interface \Device\NPF_{AA63C778-9B84-4CE8-AECB-D80C4B97EAB5}, id 0
Ethernet II, Src: XiaomiCo_cb:34:52 (a4:55:90:cb:34:52), Dst: IPv4mcast_fb (01:00:5e:00:00:fb)
Internet Protocol Version 4, Src: 192.168.1.131, Dst: 224.0.0.251
User Datagram Protocol, Src Port: 5353, Dst Port: 5353
Multicast Domain Name System (response)

No.     Time           Source                Destination           Protocol Length Info
   2201 51.860183      192.168.1.145         192.168.1.131         TCP      1406   [TCP Retransmission] 5001 → 45594 [PSH, ACK] Seq=1 Ack=247 Win=262400 Len=1352

Frame 2201: 1406 bytes on wire (11248 bits), 1406 bytes captured (11248 bits) on interface \Device\NPF_{AA63C778-9B84-4CE8-AECB-D80C4B97EAB5}, id 0
Ethernet II, Src: PcsCompu_e2:dc:77 (08:00:27:e2:dc:77), Dst: XiaomiCo_cb:34:52 (a4:55:90:cb:34:52)
Internet Protocol Version 4, Src: 192.168.1.145, Dst: 192.168.1.131
Transmission Control Protocol, Src Port: 5001, Dst Port: 45594, Seq: 1, Ack: 247, Len: 1352

No.     Time           Source                Destination           Protocol Length Info
   2202 51.916085      192.168.1.131         192.168.1.145         TCP      60     45594 → 5001 [ACK] Seq=247 Ack=1353 Win=90624 Len=0

Frame 2202: 60 bytes on wire (480 bits), 60 bytes captured (480 bits) on interface \Device\NPF_{AA63C778-9B84-4CE8-AECB-D80C4B97EAB5}, id 0
Ethernet II, Src: XiaomiCo_cb:34:52 (a4:55:90:cb:34:52), Dst: PcsCompu_e2:dc:77 (08:00:27:e2:dc:77)
Internet Protocol Version 4, Src: 192.168.1.131, Dst: 192.168.1.145
Transmission Control Protocol, Src Port: 45594, Dst Port: 5001, Seq: 247, Ack: 1353, Len: 0

No.     Time           Source                Destination           Protocol Length Info
   2203 51.957252      192.168.1.131         192.168.1.145         TLSv1.2  61     Alert (Level: Fatal, Description: Protocol Version)

Frame 2203: 61 bytes on wire (488 bits), 61 bytes captured (488 bits) on interface \Device\NPF_{AA63C778-9B84-4CE8-AECB-D80C4B97EAB5}, id 0
Ethernet II, Src: XiaomiCo_cb:34:52 (a4:55:90:cb:34:52), Dst: PcsCompu_e2:dc:77 (08:00:27:e2:dc:77)
Internet Protocol Version 4, Src: 192.168.1.131, Dst: 192.168.1.145
Transmission Control Protocol, Src Port: 45594, Dst Port: 5001, Seq: 247, Ack: 1353, Len: 7
Transport Layer Security

No.     Time           Source                Destination           Protocol Length Info
   2204 51.963982      192.168.1.131         192.168.1.145         TCP      60     45594 → 5001 [FIN, ACK] Seq=254 Ack=1353 Win=90624 Len=0

Frame 2204: 60 bytes on wire (480 bits), 60 bytes captured (480 bits) on interface \Device\NPF_{AA63C778-9B84-4CE8-AECB-D80C4B97EAB5}, id 0
Ethernet II, Src: XiaomiCo_cb:34:52 (a4:55:90:cb:34:52), Dst: PcsCompu_e2:dc:77 (08:00:27:e2:dc:77)
Internet Protocol Version 4, Src: 192.168.1.131, Dst: 192.168.1.145
Transmission Control Protocol, Src Port: 45594, Dst Port: 5001, Seq: 254, Ack: 1353, Len: 0

No.     Time           Source                Destination           Protocol Length Info
   2205 51.964040      192.168.1.145         192.168.1.131         TCP      54     5001 → 45594 [ACK] Seq=1353 Ack=255 Win=262400 Len=0

Frame 2205: 54 bytes on wire (432 bits), 54 bytes captured (432 bits) on interface \Device\NPF_{AA63C778-9B84-4CE8-AECB-D80C4B97EAB5}, id 0
Ethernet II, Src: PcsCompu_e2:dc:77 (08:00:27:e2:dc:77), Dst: XiaomiCo_cb:34:52 (a4:55:90:cb:34:52)
Internet Protocol Version 4, Src: 192.168.1.145, Dst: 192.168.1.131
Transmission Control Protocol, Src Port: 5001, Dst Port: 45594, Seq: 1353, Ack: 255, Len: 0

No.     Time           Source                Destination           Protocol Length Info
   2206 52.323331      192.168.1.145         192.168.1.131         TCP      54     5001 → 45594 [FIN, ACK] Seq=1353 Ack=255 Win=262400 Len=0

Frame 2206: 54 bytes on wire (432 bits), 54 bytes captured (432 bits) on interface \Device\NPF_{AA63C778-9B84-4CE8-AECB-D80C4B97EAB5}, id 0
Ethernet II, Src: PcsCompu_e2:dc:77 (08:00:27:e2:dc:77), Dst: XiaomiCo_cb:34:52 (a4:55:90:cb:34:52)
Internet Protocol Version 4, Src: 192.168.1.145, Dst: 192.168.1.131
Transmission Control Protocol, Src Port: 5001, Dst Port: 45594, Seq: 1353, Ack: 255, Len: 0

No.     Time           Source                Destination           Protocol Length Info
   2207 52.428977      192.168.1.131         192.168.1.145         TCP      60     45594 → 5001 [ACK] Seq=255 Ack=1354 Win=90624 Len=0

Frame 2207: 60 bytes on wire (480 bits), 60 bytes captured (480 bits) on interface \Device\NPF_{AA63C778-9B84-4CE8-AECB-D80C4B97EAB5}, id 0
Ethernet II, Src: XiaomiCo_cb:34:52 (a4:55:90:cb:34:52), Dst: PcsCompu_e2:dc:77 (08:00:27:e2:dc:77)
Internet Protocol Version 4, Src: 192.168.1.131, Dst: 192.168.1.145
Transmission Control Protocol, Src Port: 45594, Dst Port: 5001, Seq: 255, Ack: 1354, Len: 0

No.     Time           Source                Destination           Protocol Length Info
   2210 55.904903      192.168.1.131         224.0.0.251           MDNS     136    Standard query 0x0004 PTR _%9E5E7C8F47989526C9BCD95D24084F6F0B27C5ED._sub._googlecast._tcp.local, "QM" question PTR _googlecast._tcp.local, "QM" question

Frame 2210: 136 bytes on wire (1088 bits), 136 bytes captured (1088 bits) on interface \Device\NPF_{AA63C778-9B84-4CE8-AECB-D80C4B97EAB5}, id 0
Ethernet II, Src: XiaomiCo_cb:34:52 (a4:55:90:cb:34:52), Dst: IPv4mcast_fb (01:00:5e:00:00:fb)
Internet Protocol Version 4, Src: 192.168.1.131, Dst: 224.0.0.251
User Datagram Protocol, Src Port: 5353, Dst Port: 5353
Multicast Domain Name System (query)

No.     Time           Source                Destination           Protocol Length Info
   2215 56.078175      192.168.1.131         239.255.255.250       SSDP     169    M-SEARCH * HTTP/1.1 

Frame 2215: 169 bytes on wire (1352 bits), 169 bytes captured (1352 bits) on interface \Device\NPF_{AA63C778-9B84-4CE8-AECB-D80C4B97EAB5}, id 0
Ethernet II, Src: XiaomiCo_cb:34:52 (a4:55:90:cb:34:52), Dst: IPv4mcast_7f:ff:fa (01:00:5e:7f:ff:fa)
Internet Protocol Version 4, Src: 192.168.1.131, Dst: 239.255.255.250
User Datagram Protocol, Src Port: 51050, Dst Port: 1900
Simple Service Discovery Protocol

No.     Time           Source                Destination           Protocol Length Info
   2217 57.105373      192.168.1.131         239.255.255.250       SSDP     169    M-SEARCH * HTTP/1.1 

Frame 2217: 169 bytes on wire (1352 bits), 169 bytes captured (1352 bits) on interface \Device\NPF_{AA63C778-9B84-4CE8-AECB-D80C4B97EAB5}, id 0
Ethernet II, Src: XiaomiCo_cb:34:52 (a4:55:90:cb:34:52), Dst: IPv4mcast_7f:ff:fa (01:00:5e:7f:ff:fa)
Internet Protocol Version 4, Src: 192.168.1.131, Dst: 239.255.255.250
User Datagram Protocol, Src Port: 51050, Dst Port: 1900
Simple Service Discovery Protocol

No.     Time           Source                Destination           Protocol Length Info
   2245 58.113898      192.168.1.131         239.255.255.250       SSDP     169    M-SEARCH * HTTP/1.1 

Frame 2245: 169 bytes on wire (1352 bits), 169 bytes captured (1352 bits) on interface \Device\NPF_{AA63C778-9B84-4CE8-AECB-D80C4B97EAB5}, id 0
Ethernet II, Src: XiaomiCo_cb:34:52 (a4:55:90:cb:34:52), Dst: IPv4mcast_7f:ff:fa (01:00:5e:7f:ff:fa)
Internet Protocol Version 4, Src: 192.168.1.131, Dst: 239.255.255.250
User Datagram Protocol, Src Port: 51050, Dst Port: 1900
Simple Service Discovery Protocol

No.     Time           Source                Destination           Protocol Length Info
   2253 59.143196      192.168.1.131         239.255.255.250       SSDP     169    M-SEARCH * HTTP/1.1 

Frame 2253: 169 bytes on wire (1352 bits), 169 bytes captured (1352 bits) on interface \Device\NPF_{AA63C778-9B84-4CE8-AECB-D80C4B97EAB5}, id 0
Ethernet II, Src: XiaomiCo_cb:34:52 (a4:55:90:cb:34:52), Dst: IPv4mcast_7f:ff:fa (01:00:5e:7f:ff:fa)
Internet Protocol Version 4, Src: 192.168.1.131, Dst: 239.255.255.250
User Datagram Protocol, Src Port: 51050, Dst Port: 1900
Simple Service Discovery Protocol

No.     Time           Source                Destination           Protocol Length Info
   2298 60.156195      192.168.1.131         239.255.255.250       SSDP     169    M-SEARCH * HTTP/1.1 

Frame 2298: 169 bytes on wire (1352 bits), 169 bytes captured (1352 bits) on interface \Device\NPF_{AA63C778-9B84-4CE8-AECB-D80C4B97EAB5}, id 0
Ethernet II, Src: XiaomiCo_cb:34:52 (a4:55:90:cb:34:52), Dst: IPv4mcast_7f:ff:fa (01:00:5e:7f:ff:fa)
Internet Protocol Version 4, Src: 192.168.1.131, Dst: 239.255.255.250
User Datagram Protocol, Src Port: 51050, Dst Port: 1900
Simple Service Discovery Protocol

No.     Time           Source                Destination           Protocol Length Info
   2439 61.175298      192.168.1.131         239.255.255.250       SSDP     169    M-SEARCH * HTTP/1.1 

Frame 2439: 169 bytes on wire (1352 bits), 169 bytes captured (1352 bits) on interface \Device\NPF_{AA63C778-9B84-4CE8-AECB-D80C4B97EAB5}, id 0
Ethernet II, Src: XiaomiCo_cb:34:52 (a4:55:90:cb:34:52), Dst: IPv4mcast_7f:ff:fa (01:00:5e:7f:ff:fa)
Internet Protocol Version 4, Src: 192.168.1.131, Dst: 239.255.255.250
User Datagram Protocol, Src Port: 51050, Dst Port: 1900
Simple Service Discovery Protocol

No.     Time           Source                Destination           Protocol Length Info
   2629 66.363217      192.168.1.131         224.0.0.251           MDNS     779    Standard query response 0x0000 PTR, cache flush Android.local PTR, cache flush Android.local PTR, cache flush Android.local PTR, cache flush Android.local TXT, cache flush PTR _mi-connect._udp.local PTR {"nm":"POCO X3 Pro","as":"[8194]","ip":"131"}._mi-connect._udp.local A, cache flush 192.168.1.131 AAAA, cache flush fe80::121f:4265:a44e:f48d AAAA, cache flush 2a0c:5a80:1e05:9b00:d0a:1565:4a6:b84 AAAA, cache flush 2a0c:5a80:1e05:9b00:4934:a536:fd22:142d SRV, cache flush 0 0 56666 Android.local NSEC, cache flush 131.1.168.192.in-addr.arpa NSEC, cache flush D.8.4.F.E.4.4.A.5.6.2.4.F.1.2.1.0.0.0.0.0.0.0.0.0.0.0.0.0.8.E.F.ip6.arpa NSEC, cache flush 4.8.B.0.6.A.4.0.5.6.5.1.A.0.D.0.0.0.B.9.5.0.E.1.0.8.A.5.C.0.A.2.ip6.arpa NSEC, cache flush D.2.4.1.2.2.D.F.6.3.5.A.4.3.9.4.0.0.B.9.5.0.E.1.0.8.A.5.C.0.A.2.ip6.arpa NSEC, cache flush {"nm":"POCO X3 Pro","as":"[8194]","ip":"131"}._mi-connect._udp.local NSEC, cache flush Android.local

Frame 2629: 779 bytes on wire (6232 bits), 779 bytes captured (6232 bits) on interface \Device\NPF_{AA63C778-9B84-4CE8-AECB-D80C4B97EAB5}, id 0
Ethernet II, Src: XiaomiCo_cb:34:52 (a4:55:90:cb:34:52), Dst: IPv4mcast_fb (01:00:5e:00:00:fb)
Internet Protocol Version 4, Src: 192.168.1.131, Dst: 224.0.0.251
User Datagram Protocol, Src Port: 5353, Dst Port: 5353
Multicast Domain Name System (response)

No.     Time           Source                Destination           Protocol Length Info
   2643 71.692386      192.168.1.131         192.168.1.145         TCP      74     45596 → 5001 [SYN] Seq=0 Win=65535 Len=0 MSS=1460 SACK_PERM=1 TSval=1203373274 TSecr=0 WS=512

Frame 2643: 74 bytes on wire (592 bits), 74 bytes captured (592 bits) on interface \Device\NPF_{AA63C778-9B84-4CE8-AECB-D80C4B97EAB5}, id 0
Ethernet II, Src: XiaomiCo_cb:34:52 (a4:55:90:cb:34:52), Dst: PcsCompu_e2:dc:77 (08:00:27:e2:dc:77)
Internet Protocol Version 4, Src: 192.168.1.131, Dst: 192.168.1.145
Transmission Control Protocol, Src Port: 45596, Dst Port: 5001, Seq: 0, Len: 0

No.     Time           Source                Destination           Protocol Length Info
   2644 71.692647      192.168.1.145         192.168.1.131         TCP      66     5001 → 45596 [SYN, ACK] Seq=0 Ack=1 Win=65535 Len=0 MSS=1460 WS=256 SACK_PERM=1

Frame 2644: 66 bytes on wire (528 bits), 66 bytes captured (528 bits) on interface \Device\NPF_{AA63C778-9B84-4CE8-AECB-D80C4B97EAB5}, id 0
Ethernet II, Src: PcsCompu_e2:dc:77 (08:00:27:e2:dc:77), Dst: XiaomiCo_cb:34:52 (a4:55:90:cb:34:52)
Internet Protocol Version 4, Src: 192.168.1.145, Dst: 192.168.1.131
Transmission Control Protocol, Src Port: 5001, Dst Port: 45596, Seq: 0, Ack: 1, Len: 0

No.     Time           Source                Destination           Protocol Length Info
   2645 71.699051      192.168.1.131         192.168.1.145         TCP      60     45596 → 5001 [ACK] Seq=1 Ack=1 Win=88064 Len=0

Frame 2645: 60 bytes on wire (480 bits), 60 bytes captured (480 bits) on interface \Device\NPF_{AA63C778-9B84-4CE8-AECB-D80C4B97EAB5}, id 0
Ethernet II, Src: XiaomiCo_cb:34:52 (a4:55:90:cb:34:52), Dst: PcsCompu_e2:dc:77 (08:00:27:e2:dc:77)
Internet Protocol Version 4, Src: 192.168.1.131, Dst: 192.168.1.145
Transmission Control Protocol, Src Port: 45596, Dst Port: 5001, Seq: 1, Ack: 1, Len: 0

No.     Time           Source                Destination           Protocol Length Info
   2646 72.102763      192.168.1.131         192.168.1.145         TLSv1.2  300    Client Hello

Frame 2646: 300 bytes on wire (2400 bits), 300 bytes captured (2400 bits) on interface \Device\NPF_{AA63C778-9B84-4CE8-AECB-D80C4B97EAB5}, id 0
Ethernet II, Src: XiaomiCo_cb:34:52 (a4:55:90:cb:34:52), Dst: PcsCompu_e2:dc:77 (08:00:27:e2:dc:77)
Internet Protocol Version 4, Src: 192.168.1.131, Dst: 192.168.1.145
Transmission Control Protocol, Src Port: 45596, Dst Port: 5001, Seq: 1, Ack: 1, Len: 246
Transport Layer Security

No.     Time           Source                Destination           Protocol Length Info
   2647 72.106832      192.168.1.145         192.168.1.131         TLSv1.2  1406   Server Hello, Certificate, Server Key Exchange, Server Hello Done

Frame 2647: 1406 bytes on wire (11248 bits), 1406 bytes captured (11248 bits) on interface \Device\NPF_{AA63C778-9B84-4CE8-AECB-D80C4B97EAB5}, id 0
Ethernet II, Src: PcsCompu_e2:dc:77 (08:00:27:e2:dc:77), Dst: XiaomiCo_cb:34:52 (a4:55:90:cb:34:52)
Internet Protocol Version 4, Src: 192.168.1.145, Dst: 192.168.1.131
Transmission Control Protocol, Src Port: 5001, Dst Port: 45596, Seq: 1, Ack: 247, Len: 1352
Transport Layer Security

No.     Time           Source                Destination           Protocol Length Info
   2648 72.110303      192.168.1.131         192.168.1.145         TCP      60     45596 → 5001 [ACK] Seq=247 Ack=1353 Win=90624 Len=0

Frame 2648: 60 bytes on wire (480 bits), 60 bytes captured (480 bits) on interface \Device\NPF_{AA63C778-9B84-4CE8-AECB-D80C4B97EAB5}, id 0
Ethernet II, Src: XiaomiCo_cb:34:52 (a4:55:90:cb:34:52), Dst: PcsCompu_e2:dc:77 (08:00:27:e2:dc:77)
Internet Protocol Version 4, Src: 192.168.1.131, Dst: 192.168.1.145
Transmission Control Protocol, Src Port: 45596, Dst Port: 5001, Seq: 247, Ack: 1353, Len: 0

No.     Time           Source                Destination           Protocol Length Info
   2649 72.115525      192.168.1.131         192.168.1.145         TLSv1.2  61     Alert (Level: Fatal, Description: Protocol Version)

Frame 2649: 61 bytes on wire (488 bits), 61 bytes captured (488 bits) on interface \Device\NPF_{AA63C778-9B84-4CE8-AECB-D80C4B97EAB5}, id 0
Ethernet II, Src: XiaomiCo_cb:34:52 (a4:55:90:cb:34:52), Dst: PcsCompu_e2:dc:77 (08:00:27:e2:dc:77)
Internet Protocol Version 4, Src: 192.168.1.131, Dst: 192.168.1.145
Transmission Control Protocol, Src Port: 45596, Dst Port: 5001, Seq: 247, Ack: 1353, Len: 7
Transport Layer Security

No.     Time           Source                Destination           Protocol Length Info
   2650 72.115525      192.168.1.131         192.168.1.145         TCP      60     45596 → 5001 [FIN, ACK] Seq=254 Ack=1353 Win=90624 Len=0

Frame 2650: 60 bytes on wire (480 bits), 60 bytes captured (480 bits) on interface \Device\NPF_{AA63C778-9B84-4CE8-AECB-D80C4B97EAB5}, id 0
Ethernet II, Src: XiaomiCo_cb:34:52 (a4:55:90:cb:34:52), Dst: PcsCompu_e2:dc:77 (08:00:27:e2:dc:77)
Internet Protocol Version 4, Src: 192.168.1.131, Dst: 192.168.1.145
Transmission Control Protocol, Src Port: 45596, Dst Port: 5001, Seq: 254, Ack: 1353, Len: 0

No.     Time           Source                Destination           Protocol Length Info
   2651 72.115836      192.168.1.145         192.168.1.131         TCP      54     5001 → 45596 [ACK] Seq=1353 Ack=255 Win=262400 Len=0

Frame 2651: 54 bytes on wire (432 bits), 54 bytes captured (432 bits) on interface \Device\NPF_{AA63C778-9B84-4CE8-AECB-D80C4B97EAB5}, id 0
Ethernet II, Src: PcsCompu_e2:dc:77 (08:00:27:e2:dc:77), Dst: XiaomiCo_cb:34:52 (a4:55:90:cb:34:52)
Internet Protocol Version 4, Src: 192.168.1.145, Dst: 192.168.1.131
Transmission Control Protocol, Src Port: 5001, Dst Port: 45596, Seq: 1353, Ack: 255, Len: 0

No.     Time           Source                Destination           Protocol Length Info
   2652 72.162098      192.168.1.145         192.168.1.131         TCP      54     5001 → 45596 [FIN, ACK] Seq=1353 Ack=255 Win=262400 Len=0

Frame 2652: 54 bytes on wire (432 bits), 54 bytes captured (432 bits) on interface \Device\NPF_{AA63C778-9B84-4CE8-AECB-D80C4B97EAB5}, id 0
Ethernet II, Src: PcsCompu_e2:dc:77 (08:00:27:e2:dc:77), Dst: XiaomiCo_cb:34:52 (a4:55:90:cb:34:52)
Internet Protocol Version 4, Src: 192.168.1.145, Dst: 192.168.1.131
Transmission Control Protocol, Src Port: 5001, Dst Port: 45596, Seq: 1353, Ack: 255, Len: 0

No.     Time           Source                Destination           Protocol Length Info
   2653 72.165850      192.168.1.131         192.168.1.145         TCP      60     45596 → 5001 [ACK] Seq=255 Ack=1354 Win=90624 Len=0

Frame 2653: 60 bytes on wire (480 bits), 60 bytes captured (480 bits) on interface \Device\NPF_{AA63C778-9B84-4CE8-AECB-D80C4B97EAB5}, id 0
Ethernet II, Src: XiaomiCo_cb:34:52 (a4:55:90:cb:34:52), Dst: PcsCompu_e2:dc:77 (08:00:27:e2:dc:77)
Internet Protocol Version 4, Src: 192.168.1.131, Dst: 192.168.1.145
Transmission Control Protocol, Src Port: 45596, Dst Port: 5001, Seq: 255, Ack: 1354, Len: 0

No.     Time           Source                Destination           Protocol Length Info
   2655 72.514225      192.168.1.131         239.255.255.250       SSDP     169    M-SEARCH * HTTP/1.1 

Frame 2655: 169 bytes on wire (1352 bits), 169 bytes captured (1352 bits) on interface \Device\NPF_{AA63C778-9B84-4CE8-AECB-D80C4B97EAB5}, id 0
Ethernet II, Src: XiaomiCo_cb:34:52 (a4:55:90:cb:34:52), Dst: IPv4mcast_7f:ff:fa (01:00:5e:7f:ff:fa)
Internet Protocol Version 4, Src: 192.168.1.131, Dst: 239.255.255.250
User Datagram Protocol, Src Port: 51050, Dst Port: 1900
Simple Service Discovery Protocol

No.     Time           Source                Destination           Protocol Length Info
   2659 73.532991      192.168.1.131         239.255.255.250       SSDP     169    M-SEARCH * HTTP/1.1 

Frame 2659: 169 bytes on wire (1352 bits), 169 bytes captured (1352 bits) on interface \Device\NPF_{AA63C778-9B84-4CE8-AECB-D80C4B97EAB5}, id 0
Ethernet II, Src: XiaomiCo_cb:34:52 (a4:55:90:cb:34:52), Dst: IPv4mcast_7f:ff:fa (01:00:5e:7f:ff:fa)
Internet Protocol Version 4, Src: 192.168.1.131, Dst: 239.255.255.250
User Datagram Protocol, Src Port: 51050, Dst Port: 1900
Simple Service Discovery Protocol

No.     Time           Source                Destination           Protocol Length Info
   2663 74.594983      192.168.1.131         239.255.255.250       SSDP     169    M-SEARCH * HTTP/1.1 

Frame 2663: 169 bytes on wire (1352 bits), 169 bytes captured (1352 bits) on interface \Device\NPF_{AA63C778-9B84-4CE8-AECB-D80C4B97EAB5}, id 0
Ethernet II, Src: XiaomiCo_cb:34:52 (a4:55:90:cb:34:52), Dst: IPv4mcast_7f:ff:fa (01:00:5e:7f:ff:fa)
Internet Protocol Version 4, Src: 192.168.1.131, Dst: 239.255.255.250
User Datagram Protocol, Src Port: 51050, Dst Port: 1900
Simple Service Discovery Protocol

No.     Time           Source                Destination           Protocol Length Info
   2666 75.614639      192.168.1.131         239.255.255.250       SSDP     169    M-SEARCH * HTTP/1.1 

Frame 2666: 169 bytes on wire (1352 bits), 169 bytes captured (1352 bits) on interface \Device\NPF_{AA63C778-9B84-4CE8-AECB-D80C4B97EAB5}, id 0
Ethernet II, Src: XiaomiCo_cb:34:52 (a4:55:90:cb:34:52), Dst: IPv4mcast_7f:ff:fa (01:00:5e:7f:ff:fa)
Internet Protocol Version 4, Src: 192.168.1.131, Dst: 239.255.255.250
User Datagram Protocol, Src Port: 51050, Dst Port: 1900
Simple Service Discovery Protocol

No.     Time           Source                Destination           Protocol Length Info
   2669 75.907843      192.168.1.131         224.0.0.251           MDNS     136    Standard query 0x0005 PTR _%9E5E7C8F47989526C9BCD95D24084F6F0B27C5ED._sub._googlecast._tcp.local, "QM" question PTR _googlecast._tcp.local, "QM" question

Frame 2669: 136 bytes on wire (1088 bits), 136 bytes captured (1088 bits) on interface \Device\NPF_{AA63C778-9B84-4CE8-AECB-D80C4B97EAB5}, id 0
Ethernet II, Src: XiaomiCo_cb:34:52 (a4:55:90:cb:34:52), Dst: IPv4mcast_fb (01:00:5e:00:00:fb)
Internet Protocol Version 4, Src: 192.168.1.131, Dst: 224.0.0.251
User Datagram Protocol, Src Port: 5353, Dst Port: 5353
Multicast Domain Name System (query)

No.     Time           Source                Destination           Protocol Length Info
   2674 76.631433      192.168.1.131         239.255.255.250       SSDP     169    M-SEARCH * HTTP/1.1 

Frame 2674: 169 bytes on wire (1352 bits), 169 bytes captured (1352 bits) on interface \Device\NPF_{AA63C778-9B84-4CE8-AECB-D80C4B97EAB5}, id 0
Ethernet II, Src: XiaomiCo_cb:34:52 (a4:55:90:cb:34:52), Dst: IPv4mcast_7f:ff:fa (01:00:5e:7f:ff:fa)
Internet Protocol Version 4, Src: 192.168.1.131, Dst: 239.255.255.250
User Datagram Protocol, Src Port: 51050, Dst Port: 1900
Simple Service Discovery Protocol

No.     Time           Source                Destination           Protocol Length Info
   2679 77.649909      192.168.1.131         239.255.255.250       SSDP     169    M-SEARCH * HTTP/1.1 

Frame 2679: 169 bytes on wire (1352 bits), 169 bytes captured (1352 bits) on interface \Device\NPF_{AA63C778-9B84-4CE8-AECB-D80C4B97EAB5}, id 0
Ethernet II, Src: XiaomiCo_cb:34:52 (a4:55:90:cb:34:52), Dst: IPv4mcast_7f:ff:fa (01:00:5e:7f:ff:fa)
Internet Protocol Version 4, Src: 192.168.1.131, Dst: 239.255.255.250
User Datagram Protocol, Src Port: 51050, Dst Port: 1900
Simple Service Discovery Protocol

No.     Time           Source                Destination           Protocol Length Info
   2685 82.406459      192.168.1.131         192.168.1.145         TCP      74     45598 → 5001 [SYN] Seq=0 Win=65535 Len=0 MSS=1460 SACK_PERM=1 TSval=1203383981 TSecr=0 WS=512

Frame 2685: 74 bytes on wire (592 bits), 74 bytes captured (592 bits) on interface \Device\NPF_{AA63C778-9B84-4CE8-AECB-D80C4B97EAB5}, id 0
Ethernet II, Src: XiaomiCo_cb:34:52 (a4:55:90:cb:34:52), Dst: PcsCompu_e2:dc:77 (08:00:27:e2:dc:77)
Internet Protocol Version 4, Src: 192.168.1.131, Dst: 192.168.1.145
Transmission Control Protocol, Src Port: 45598, Dst Port: 5001, Seq: 0, Len: 0

No.     Time           Source                Destination           Protocol Length Info
   2686 82.406566      192.168.1.145         192.168.1.131         TCP      66     5001 → 45598 [SYN, ACK] Seq=0 Ack=1 Win=65535 Len=0 MSS=1460 WS=256 SACK_PERM=1

Frame 2686: 66 bytes on wire (528 bits), 66 bytes captured (528 bits) on interface \Device\NPF_{AA63C778-9B84-4CE8-AECB-D80C4B97EAB5}, id 0
Ethernet II, Src: PcsCompu_e2:dc:77 (08:00:27:e2:dc:77), Dst: XiaomiCo_cb:34:52 (a4:55:90:cb:34:52)
Internet Protocol Version 4, Src: 192.168.1.145, Dst: 192.168.1.131
Transmission Control Protocol, Src Port: 5001, Dst Port: 45598, Seq: 0, Ack: 1, Len: 0

No.     Time           Source                Destination           Protocol Length Info
   2687 82.413346      192.168.1.131         192.168.1.145         TCP      60     45598 → 5001 [ACK] Seq=1 Ack=1 Win=88064 Len=0

Frame 2687: 60 bytes on wire (480 bits), 60 bytes captured (480 bits) on interface \Device\NPF_{AA63C778-9B84-4CE8-AECB-D80C4B97EAB5}, id 0
Ethernet II, Src: XiaomiCo_cb:34:52 (a4:55:90:cb:34:52), Dst: PcsCompu_e2:dc:77 (08:00:27:e2:dc:77)
Internet Protocol Version 4, Src: 192.168.1.131, Dst: 192.168.1.145
Transmission Control Protocol, Src Port: 45598, Dst Port: 5001, Seq: 1, Ack: 1, Len: 0

No.     Time           Source                Destination           Protocol Length Info
   2688 82.829426      192.168.1.131         192.168.1.145         TLSv1.2  300    Client Hello

Frame 2688: 300 bytes on wire (2400 bits), 300 bytes captured (2400 bits) on interface \Device\NPF_{AA63C778-9B84-4CE8-AECB-D80C4B97EAB5}, id 0
Ethernet II, Src: XiaomiCo_cb:34:52 (a4:55:90:cb:34:52), Dst: PcsCompu_e2:dc:77 (08:00:27:e2:dc:77)
Internet Protocol Version 4, Src: 192.168.1.131, Dst: 192.168.1.145
Transmission Control Protocol, Src Port: 45598, Dst Port: 5001, Seq: 1, Ack: 1, Len: 246
Transport Layer Security

No.     Time           Source                Destination           Protocol Length Info
   2689 82.832361      192.168.1.145         192.168.1.131         TLSv1.2  1406   Server Hello, Certificate, Server Key Exchange, Server Hello Done

Frame 2689: 1406 bytes on wire (11248 bits), 1406 bytes captured (11248 bits) on interface \Device\NPF_{AA63C778-9B84-4CE8-AECB-D80C4B97EAB5}, id 0
Ethernet II, Src: PcsCompu_e2:dc:77 (08:00:27:e2:dc:77), Dst: XiaomiCo_cb:34:52 (a4:55:90:cb:34:52)
Internet Protocol Version 4, Src: 192.168.1.145, Dst: 192.168.1.131
Transmission Control Protocol, Src Port: 5001, Dst Port: 45598, Seq: 1, Ack: 247, Len: 1352
Transport Layer Security

No.     Time           Source                Destination           Protocol Length Info
   2690 82.838178      192.168.1.131         192.168.1.145         TCP      60     45598 → 5001 [ACK] Seq=247 Ack=1353 Win=90624 Len=0

Frame 2690: 60 bytes on wire (480 bits), 60 bytes captured (480 bits) on interface \Device\NPF_{AA63C778-9B84-4CE8-AECB-D80C4B97EAB5}, id 0
Ethernet II, Src: XiaomiCo_cb:34:52 (a4:55:90:cb:34:52), Dst: PcsCompu_e2:dc:77 (08:00:27:e2:dc:77)
Internet Protocol Version 4, Src: 192.168.1.131, Dst: 192.168.1.145
Transmission Control Protocol, Src Port: 45598, Dst Port: 5001, Seq: 247, Ack: 1353, Len: 0

No.     Time           Source                Destination           Protocol Length Info
   2691 82.853016      192.168.1.131         192.168.1.145         TLSv1.2  61     Alert (Level: Fatal, Description: Protocol Version)

Frame 2691: 61 bytes on wire (488 bits), 61 bytes captured (488 bits) on interface \Device\NPF_{AA63C778-9B84-4CE8-AECB-D80C4B97EAB5}, id 0
Ethernet II, Src: XiaomiCo_cb:34:52 (a4:55:90:cb:34:52), Dst: PcsCompu_e2:dc:77 (08:00:27:e2:dc:77)
Internet Protocol Version 4, Src: 192.168.1.131, Dst: 192.168.1.145
Transmission Control Protocol, Src Port: 45598, Dst Port: 5001, Seq: 247, Ack: 1353, Len: 7
Transport Layer Security

No.     Time           Source                Destination           Protocol Length Info
   2692 82.853016      192.168.1.131         192.168.1.145         TCP      60     45598 → 5001 [FIN, ACK] Seq=254 Ack=1353 Win=90624 Len=0

Frame 2692: 60 bytes on wire (480 bits), 60 bytes captured (480 bits) on interface \Device\NPF_{AA63C778-9B84-4CE8-AECB-D80C4B97EAB5}, id 0
Ethernet II, Src: XiaomiCo_cb:34:52 (a4:55:90:cb:34:52), Dst: PcsCompu_e2:dc:77 (08:00:27:e2:dc:77)
Internet Protocol Version 4, Src: 192.168.1.131, Dst: 192.168.1.145
Transmission Control Protocol, Src Port: 45598, Dst Port: 5001, Seq: 254, Ack: 1353, Len: 0

No.     Time           Source                Destination           Protocol Length Info
   2693 82.853366      192.168.1.145         192.168.1.131         TCP      54     5001 → 45598 [ACK] Seq=1353 Ack=255 Win=262400 Len=0

Frame 2693: 54 bytes on wire (432 bits), 54 bytes captured (432 bits) on interface \Device\NPF_{AA63C778-9B84-4CE8-AECB-D80C4B97EAB5}, id 0
Ethernet II, Src: PcsCompu_e2:dc:77 (08:00:27:e2:dc:77), Dst: XiaomiCo_cb:34:52 (a4:55:90:cb:34:52)
Internet Protocol Version 4, Src: 192.168.1.145, Dst: 192.168.1.131
Transmission Control Protocol, Src Port: 5001, Dst Port: 45598, Seq: 1353, Ack: 255, Len: 0

No.     Time           Source                Destination           Protocol Length Info
   2694 82.892099      192.168.1.145         192.168.1.131         TCP      54     5001 → 45598 [FIN, ACK] Seq=1353 Ack=255 Win=262400 Len=0

Frame 2694: 54 bytes on wire (432 bits), 54 bytes captured (432 bits) on interface \Device\NPF_{AA63C778-9B84-4CE8-AECB-D80C4B97EAB5}, id 0
Ethernet II, Src: PcsCompu_e2:dc:77 (08:00:27:e2:dc:77), Dst: XiaomiCo_cb:34:52 (a4:55:90:cb:34:52)
Internet Protocol Version 4, Src: 192.168.1.145, Dst: 192.168.1.131
Transmission Control Protocol, Src Port: 5001, Dst Port: 45598, Seq: 1353, Ack: 255, Len: 0

No.     Time           Source                Destination           Protocol Length Info
   2695 82.895960      192.168.1.131         192.168.1.145         TCP      60     45598 → 5001 [ACK] Seq=255 Ack=1354 Win=90624 Len=0

Frame 2695: 60 bytes on wire (480 bits), 60 bytes captured (480 bits) on interface \Device\NPF_{AA63C778-9B84-4CE8-AECB-D80C4B97EAB5}, id 0
Ethernet II, Src: XiaomiCo_cb:34:52 (a4:55:90:cb:34:52), Dst: PcsCompu_e2:dc:77 (08:00:27:e2:dc:77)
Internet Protocol Version 4, Src: 192.168.1.131, Dst: 192.168.1.145
Transmission Control Protocol, Src Port: 45598, Dst Port: 5001, Seq: 255, Ack: 1354, Len: 0

No.     Time           Source                Destination           Protocol Length Info
   2706 87.180762      192.168.1.131         224.0.0.251           MDNS     136    Standard query response 0x0000 PTR {"nm":"POCO X3 Pro","as":"[8194]","ip":"131"}._mi-connect._udp.local

Frame 2706: 136 bytes on wire (1088 bits), 136 bytes captured (1088 bits) on interface \Device\NPF_{AA63C778-9B84-4CE8-AECB-D80C4B97EAB5}, id 0
Ethernet II, Src: XiaomiCo_cb:34:52 (a4:55:90:cb:34:52), Dst: IPv4mcast_fb (01:00:5e:00:00:fb)
Internet Protocol Version 4, Src: 192.168.1.131, Dst: 224.0.0.251
User Datagram Protocol, Src Port: 5353, Dst Port: 5353
Multicast Domain Name System (response)

No.     Time           Source                Destination           Protocol Length Info
   2709 89.043782      192.168.1.131         239.255.255.250       SSDP     169    M-SEARCH * HTTP/1.1 

Frame 2709: 169 bytes on wire (1352 bits), 169 bytes captured (1352 bits) on interface \Device\NPF_{AA63C778-9B84-4CE8-AECB-D80C4B97EAB5}, id 0
Ethernet II, Src: XiaomiCo_cb:34:52 (a4:55:90:cb:34:52), Dst: IPv4mcast_7f:ff:fa (01:00:5e:7f:ff:fa)
Internet Protocol Version 4, Src: 192.168.1.131, Dst: 239.255.255.250
User Datagram Protocol, Src Port: 51050, Dst Port: 1900
Simple Service Discovery Protocol

No.     Time           Source                Destination           Protocol Length Info
   2710 89.184209      192.168.1.131         224.0.0.251           MDNS     136    Standard query response 0x0000 PTR {"nm":"POCO X3 Pro","as":"[8194]","ip":"131"}._mi-connect._udp.local

Frame 2710: 136 bytes on wire (1088 bits), 136 bytes captured (1088 bits) on interface \Device\NPF_{AA63C778-9B84-4CE8-AECB-D80C4B97EAB5}, id 0
Ethernet II, Src: XiaomiCo_cb:34:52 (a4:55:90:cb:34:52), Dst: IPv4mcast_fb (01:00:5e:00:00:fb)
Internet Protocol Version 4, Src: 192.168.1.131, Dst: 224.0.0.251
User Datagram Protocol, Src Port: 5353, Dst Port: 5353
Multicast Domain Name System (response)

No.     Time           Source                Destination           Protocol Length Info
   2713 90.062993      192.168.1.131         239.255.255.250       SSDP     169    M-SEARCH * HTTP/1.1 

Frame 2713: 169 bytes on wire (1352 bits), 169 bytes captured (1352 bits) on interface \Device\NPF_{AA63C778-9B84-4CE8-AECB-D80C4B97EAB5}, id 0
Ethernet II, Src: XiaomiCo_cb:34:52 (a4:55:90:cb:34:52), Dst: IPv4mcast_7f:ff:fa (01:00:5e:7f:ff:fa)
Internet Protocol Version 4, Src: 192.168.1.131, Dst: 239.255.255.250
User Datagram Protocol, Src Port: 51050, Dst Port: 1900
Simple Service Discovery Protocol

No.     Time           Source                Destination           Protocol Length Info
   2717 91.085413      192.168.1.131         239.255.255.250       SSDP     169    M-SEARCH * HTTP/1.1 

Frame 2717: 169 bytes on wire (1352 bits), 169 bytes captured (1352 bits) on interface \Device\NPF_{AA63C778-9B84-4CE8-AECB-D80C4B97EAB5}, id 0
Ethernet II, Src: XiaomiCo_cb:34:52 (a4:55:90:cb:34:52), Dst: IPv4mcast_7f:ff:fa (01:00:5e:7f:ff:fa)
Internet Protocol Version 4, Src: 192.168.1.131, Dst: 239.255.255.250
User Datagram Protocol, Src Port: 51050, Dst Port: 1900
Simple Service Discovery Protocol

No.     Time           Source                Destination           Protocol Length Info
   2718 91.194121      192.168.1.131         224.0.0.251           MDNS     136    Standard query response 0x0000 PTR {"nm":"POCO X3 Pro","as":"[8194]","ip":"131"}._mi-connect._udp.local

Frame 2718: 136 bytes on wire (1088 bits), 136 bytes captured (1088 bits) on interface \Device\NPF_{AA63C778-9B84-4CE8-AECB-D80C4B97EAB5}, id 0
Ethernet II, Src: XiaomiCo_cb:34:52 (a4:55:90:cb:34:52), Dst: IPv4mcast_fb (01:00:5e:00:00:fb)
Internet Protocol Version 4, Src: 192.168.1.131, Dst: 224.0.0.251
User Datagram Protocol, Src Port: 5353, Dst Port: 5353
Multicast Domain Name System (response)

No.     Time           Source                Destination           Protocol Length Info
   2725 92.137771      192.168.1.131         239.255.255.250       SSDP     169    M-SEARCH * HTTP/1.1 

Frame 2725: 169 bytes on wire (1352 bits), 169 bytes captured (1352 bits) on interface \Device\NPF_{AA63C778-9B84-4CE8-AECB-D80C4B97EAB5}, id 0
Ethernet II, Src: XiaomiCo_cb:34:52 (a4:55:90:cb:34:52), Dst: IPv4mcast_7f:ff:fa (01:00:5e:7f:ff:fa)
Internet Protocol Version 4, Src: 192.168.1.131, Dst: 239.255.255.250
User Datagram Protocol, Src Port: 51050, Dst Port: 1900
Simple Service Discovery Protocol

No.     Time           Source                Destination           Protocol Length Info
   2728 93.176112      192.168.1.131         239.255.255.250       SSDP     169    M-SEARCH * HTTP/1.1 

Frame 2728: 169 bytes on wire (1352 bits), 169 bytes captured (1352 bits) on interface \Device\NPF_{AA63C778-9B84-4CE8-AECB-D80C4B97EAB5}, id 0
Ethernet II, Src: XiaomiCo_cb:34:52 (a4:55:90:cb:34:52), Dst: IPv4mcast_7f:ff:fa (01:00:5e:7f:ff:fa)
Internet Protocol Version 4, Src: 192.168.1.131, Dst: 239.255.255.250
User Datagram Protocol, Src Port: 51050, Dst Port: 1900
Simple Service Discovery Protocol

No.     Time           Source                Destination           Protocol Length Info
   2731 94.240789      192.168.1.131         239.255.255.250       SSDP     169    M-SEARCH * HTTP/1.1 

Frame 2731: 169 bytes on wire (1352 bits), 169 bytes captured (1352 bits) on interface \Device\NPF_{AA63C778-9B84-4CE8-AECB-D80C4B97EAB5}, id 0
Ethernet II, Src: XiaomiCo_cb:34:52 (a4:55:90:cb:34:52), Dst: IPv4mcast_7f:ff:fa (01:00:5e:7f:ff:fa)
Internet Protocol Version 4, Src: 192.168.1.131, Dst: 239.255.255.250
User Datagram Protocol, Src Port: 51050, Dst Port: 1900
Simple Service Discovery Protocol
```

**Comment by ComptonAlvaro** [comment]
In the computer that it works, it is used TLS1.3 instead of 1.2.

```
No.     Time           Source                Destination           Protocol Length Info
     28 6.536497       192.168.1.131         192.168.1.200         TLSv1.3  146    Change Cipher Spec, Application Data
```

Could it be the problem? Perhaps it is because the second server is not configure in the right way? Perhaps I need to configure something in the second server to force to use TLS1.3?

**Comment by wfurt** [comment]
can you post the binary file and filter only for relevant traffic e.g `port == 5001'. TLS 1.3 cannot be forced on older windows. It is unlikely that is the problem. If anything it is usually the other way around e.g. there are issue with 1.3.

**Comment by ComptonAlvaro** [comment]
[byte de paquetes.zip](https://github.com/dotnet/aspnetcore/files/9542095/byte.de.paquetes.zip)

This file is the result to export the binary package.

**Comment by wfurt** [comment]
There should no export. Just save as pcap e.g. native (binary) format. In ideal case there would be two capture - one that works and one that does not so we can look at the differences.

**Comment by ComptonAlvaro** [comment]
[WiresharkLog.zip](https://github.com/dotnet/aspnetcore/files/9545846/WiresharkLog.zip)

Now I choose the option save as and I use pcap file format. I have added two logs, one when I call from the android device (error) and another that it is called from a WPF application (correct).

**Comment by ComptonAlvaro** [comment]
I could find the problem.

In the android project, I am using the network_security_config.xml to add the domain in which to trust and add the self signed root certificate in which trust.

This was my original configuration:

```
<?xml version="1.0" encoding="utf-8"?>
<network-security-config>
  <domain-config>
    <!--NOTA: el subdominio es necesario porque si no no se podrá instalar-->
    <domain includeSubdomains="true">192.168.1.200</domain>
    <trust-anchors>
      <certificates src="@raw/ca"/>
    </trust-anchors>
  </domain-config>
</network-security-config>
```

In only have the IP of the domain of the first computer. But if I added the IP of the second computer, it works:

```
<?xml version="1.0" encoding="utf-8"?>
<network-security-config>
  <domain-config>
    <!--NOTA: el subdominio es necesario porque si no no se podrá instalar-->
    <domain includeSubdomains="true">192.168.1.200</domain>
    <domain includeSubdomains="true">192.168.1.145</domain>
    <trust-anchors>
      <certificates src="@raw/ca"/>
    </trust-anchors>
  </domain-config>
</network-security-config>
```

So the problem is that I need 2 things:

1.- Create the certificates in the correct way, adding the SAN.
2.- Configure this config file to set the CA and the domains in which the application can trust.



Thanks so much for the help.
