### ISSUE TITLE
Kestrel SSL doesn't work when running on Linux

### ISSUE THREAD

**Issue by zeinali0** [dotnet/aspnetcore#27033]
### Describe the bug
Is there any limitation for .pfx file we use in Kestrel?
Because i'm using a pfx file which is work fine on IIS even work fine when i run my application in visual studio with Kestrel but when use it with kestrel in linux it doesn't work and it couldn't do handshaking.

### To Reproduce
I just config a  simple SSL like this:
And run my app on Centos 8 with `dotnet MyApp.dll &`
```
option.Listen(IPAddress.Any, 5000, builder =>
                        {
                            builder.UseHttps("my-cert.pfx", "mypassword");
                        });
```
Also logs show :
```
info: Microsoft.Hosting.Lifetime[0]
      Now listening on: https://0.0.0.0:5000
```

### Exceptions (if any)
I don't see any exception on server side logs. but in client side:
```
[host]# openssl s_client -connect localhost:5000
CONNECTED(00000004)
write:errno=0
---
no peer certificate available
---
No client certificate CA names sent
---
SSL handshake has read 0 bytes and written 317 bytes
Verification: OK
---
New, (NONE), Cipher is (NONE)
Secure Renegotiation IS NOT supported
Compression: NONE
Expansion: NONE
No ALPN negotiated
Early data was not sent
Verify return code: 0 (ok)
```

```
curl -v -l https://localhost:5000
* Rebuilt URL to: https://localhost:5000/
*   Trying ::1...
* TCP_NODELAY set
* connect to ::1 port 5000 failed: Connection refused
*   Trying 127.0.0.1...
* TCP_NODELAY set
* Connected to localhost (127.0.0.1) port 5000 (#0)
* ALPN, offering h2
* ALPN, offering http/1.1
* successfully set certificate verify locations:
*   CAfile: /etc/pki/tls/certs/ca-bundle.crt
  CApath: none
* TLSv1.3 (OUT), TLS handshake, Client hello (1):
* OpenSSL SSL_connect: SSL_ERROR_SYSCALL in connection to localhost:5000
* Closing connection 0
curl: (35) OpenSSL SSL_connect: SSL_ERROR_SYSCALL in connection to localhost:5000
```

### Further technical details
- ASP.NET Core 3.1
```
[root@db-n4 hamyar]# dotnet --info
.NET Core SDK (reflecting any global.json):
 Version:   3.1.102
 Commit:    573d158fea

Runtime Environment:
 OS Name:     centos
 OS Version:  8
 OS Platform: Linux
 RID:         centos.8-x64
 Base Path:   /usr/share/dotnet/sdk/3.1.102/

Host (useful for support):
  Version: 3.1.2
  Commit:  916b5cba26

.NET Core SDKs installed:
  3.1.102 [/usr/share/dotnet/sdk]

.NET Core runtimes installed:
  Microsoft.AspNetCore.App 3.1.2 [/usr/share/dotnet/shared/Microsoft.AspNetCore.App]
  Microsoft.NETCore.App 3.1.2 [/usr/share/dotnet/shared/Microsoft.NETCore.App]

To install additional .NET Core runtimes or SDKs:
  https://aka.ms/dotnet-download
```

**Comment by BrennanConroy** [comment]
Can you turn on Debug logs and share them? Handshake errors generally wont show up for higher log levels.

**Comment by halter73** [comment]
https://docs.microsoft.com/en-us/aspnet/core/fundamentals/logging/?view=aspnetcore-3.1#configure-logging

**Comment by zeinali0** [comment]
logs:
 ```
dbug: Microsoft.AspNetCore.Server.Kestrel[39]
      Connection id "0HM3KFAJV5483" accepted.
dbug: Microsoft.AspNetCore.Server.Kestrel[1]
      Connection id "0HM3KFAJV5483" started.
dbug: Microsoft.Extensions.Http.DefaultHttpClientFactory[100]
      Starting HttpMessageHandler cleanup cycle with 7 items
dbug: Microsoft.Extensions.Http.DefaultHttpClientFactory[101]
      Ending HttpMessageHandler cleanup cycle after 0.0062ms - processed: 0 items - remaining: 7 items
dbug: Microsoft.AspNetCore.Server.Kestrel.Transport.Sockets[6]
      Connection id "0HM3KFAJV543F" received FIN.
dbug: MTProto.Core.MTProtoConnectionHandler[6]
      OnConnectedAsync ending.
dbug: Microsoft.AspNetCore.Server.Kestrel[2]
      Connection id "0HM3KFAJV543F" stopped.
dbug: Microsoft.AspNetCore.Server.Kestrel.Transport.Sockets[7]
      Connection id "0HM3KFAJV543F" sending FIN because: "The Socket transport's send loop completed gracefully."
dbug: Microsoft.AspNetCore.Server.Kestrel.Transport.Sockets[7]
      Connection id "0HM3KFAJV5483" sending FIN because: "The connection was aborted by the application via ConnectionContext.Abort()."
dbug: Microsoft.Extensions.Http.DefaultHttpClientFactory[100]
      Starting HttpMessageHandler cleanup cycle with 7 items
dbug: Microsoft.Extensions.Http.DefaultHttpClientFactory[101]
      Ending HttpMessageHandler cleanup cycle after 0.0069ms - processed: 0 items - remaining: 7 items
dbug: Microsoft.AspNetCore.Server.Kestrel.Https.Internal.HttpsConnectionMiddleware[2]
      Authentication of the HTTPS connection timed out.
dbug: Microsoft.AspNetCore.Server.Kestrel[2]
      Connection id "0HM3KFAJV5480" stopped.
```

**Comment by halter73** [comment]
```
dbug: Microsoft.AspNetCore.Server.Kestrel.Https.Internal.HttpsConnectionMiddleware[2]
     Authentication of the HTTPS connection timed out.
```

That indicates that [SslStream.AuthenticateAsServerAsync()](https://docs.microsoft.com/en-us/dotnet/api/system.net.security.sslstream.authenticateasserverasync?view=netcore-3.1) got canceled after exceeding Kestrel's [HandshakeTimeout](https://docs.microsoft.com/en-us/dotnet/api/microsoft.aspnetcore.server.kestrel.https.httpsconnectionadapteroptions.handshaketimeout?view=aspnetcore-3.1#Microsoft_AspNetCore_Server_Kestrel_Https_HttpsConnectionAdapterOptions_HandshakeTimeout) which defaults to 10 seconds. Does 10 seconds line up with the `* OpenSSL SSL_connect: SSL_ERROR_SYSCALL in connection to localhost:5000` log you're seeing from curl?

I'm not sure why the handshake is taking that long. Can you collect a wireshark/tshark capture and share it?

**Comment by zeinali0** [comment]
Yes, it take 10 seconds.
I don't think it is about network problem  because when I set up default SSL with `dotnet dev-certs https` and use Default it doesn't timeout and do handshaking.

**Comment by halter73** [comment]
I also doubt it's a network problem. If the dev cert works, that points to a problem with the certificate.

When generating your certificate, did you follow the steps at https://devblogs.microsoft.com/aspnet/configuring-https-in-asp-net-core-across-different-platforms/#linux-mac? Kestrel has requirements about the cert having the right EKUs configured and stuff like that. Kestrel should fail to start if the certificate requirements aren't met, but it's possible we missed something.

If there is something wrong with the cert and following the linked steps fixes it, could you post back with the steps you took to generate the problematic cert? That could help us provide better errors to the next developer to run into the issue.

Even if it's not a network problem, a wireshark trace could help diagnose what's going on by showing where the handshake is stopping.

**Comment by zeinali0** [comment]
It's not a self-signed certificate, I export .pfx file from IIS 10.
I've just test same code with same pfx file on another machine with higher version of dotnet-3.1 it worked fine

```
dotnet --info
.NET Core SDK (reflecting any global.json):
 Version:   3.1.107
 Commit:    617a3e03f4

Runtime Environment:
 OS Name:     centos
 OS Version:  8
 OS Platform: Linux
 RID:         centos.8-x64
 Base Path:   /usr/lib64/dotnet/sdk/3.1.107/

Host (useful for support):
  Version: 3.1.7
  Commit:  fcfdef8d6b

.NET Core SDKs installed:
  3.1.107 [/usr/lib64/dotnet/sdk]

.NET Core runtimes installed:
  Microsoft.AspNetCore.App 3.1.7 [/usr/lib64/dotnet/shared/Microsoft.AspNetCore.                                                                                                             App]
  Microsoft.NETCore.App 3.1.7 [/usr/lib64/dotnet/shared/Microsoft.NETCore.App]

To install additional .NET Core runtimes or SDKs:
  https://aka.ms/dotnet-download
```

**Comment by zeinali0** [comment]
I've not updated other machine yet. I will report the result when I done.

**Comment by zeinali0** [comment]
Updating doesn't fixed the problem I updated to version 3.1.9

**Comment by patryk9200** [comment]
I have exactly the same problem. 
I have OpenSSL 1.1.1f  31 Mar 2020 installed on linux  Ubuntu 20.04.1 LTS server.
This issue happens on Kestrel with and without using Libuv. Without Libuv site is unusable.
With libuv it's usable but still sometimes there are issues with SSL.
Below is my exceptions:
`fail: Microsoft.AspNetCore.Server.Kestrel[0]
      Unexpected exception in TimingPipeFlusher.FlushAsync.
System.IO.IOException: The encryption operation failed, see inner exception.
 ---> Interop+OpenSsl+SslException: Encrypt failed with OpenSSL error - SSL_ERROR_SYSCALL.
   at Interop.OpenSsl.Encrypt(SafeSslHandle context, ReadOnlyMemory`1 input, Byte[]& output, SslErrorCode& errorCode)
   at System.Net.Security.SslStreamPal.EncryptDecryptHelper(SafeDeleteContext securityContext, ReadOnlyMemory`1 input, Int32 offset, Int32 size, Boolean encrypt, Byte[]& output, Int32& resultSize)
   --- End of inner exception stack trace ---
   at System.Net.Security.SslStream.WriteAsyncInternal[TWriteAdapter](TWriteAdapter writeAdapter, ReadOnlyMemory`1 buffer)
   at System.IO.Pipelines.StreamPipeWriter.FlushAsyncInternal(CancellationToken cancellationToken)
   at Microsoft.AspNetCore.Server.Kestrel.Core.Internal.Infrastructure.PipeWriterHelpers.ConcurrentPipeWriter.FlushAsyncAwaited(ValueTask`1 flushTask, CancellationToken cancellationToken)
   at Microsoft.AspNetCore.Server.Kestrel.Core.Internal.Infrastructure.PipeWriterHelpers.TimingPipeFlusher.TimeFlushAsyncAwaited(ValueTask`1 pipeFlushTask, MinDataRate minRate, IHttpOutputAborter outputAborter, CancellationToken cancellationToken)
fail: Microsoft.AspNetCore.Server.Kestrel[0]
      Unhandled exception while processing 0HM3KPMG2JPLF.
System.IO.IOException: The encryption operation failed, see inner exception.
 ---> Interop+OpenSsl+SslException: Encrypt failed with OpenSSL error - SSL_ERROR_SYSCALL.
 ---> System.IO.IOException: No such file or directory
   --- End of inner exception stack trace ---
   at Interop.OpenSsl.Encrypt(SafeSslHandle context, ReadOnlyMemory`1 input, Byte[]& output, SslErrorCode& errorCode)
   at System.Net.Security.SslStreamPal.EncryptDecryptHelper(SafeDeleteContext securityContext, ReadOnlyMemory`1 input, Int32 offset, Int32 size, Boolean encrypt, Byte[]& output, Int32& resultSize)
   --- End of inner exception stack trace ---
   at System.Net.Security.SslStream.WriteAsyncInternal[TWriteAdapter](TWriteAdapter writeAdapter, ReadOnlyMemory`1 buffer)
   at System.IO.Pipelines.StreamPipeWriter.FlushAsyncInternal(CancellationToken cancellationToken)
   at System.IO.Pipelines.StreamPipeWriter.CompleteAsync(Exception exception)
   at Microsoft.AspNetCore.Server.Kestrel.Core.Internal.DuplexPipeStreamAdapter`1.DisposeAsync()
   at Microsoft.AspNetCore.Server.Kestrel.Https.Internal.HttpsConnectionMiddleware.InnerOnConnectionAsync(ConnectionContext context)
   at Microsoft.AspNetCore.Server.Kestrel.Https.Internal.HttpsConnectionMiddleware.InnerOnConnectionAsync(ConnectionContext context)
   at Microsoft.AspNetCore.Server.Kestrel.Core.Internal.Infrastructure.KestrelConnection.ExecuteAsync()
fail: Microsoft.AspNetCore.Server.Kestrel[0]
      Unexpected exception in TimingPipeFlusher.FlushAsync.
System.IO.IOException: The encryption operation failed, see inner exception.
 ---> Interop+OpenSsl+SslException: Encrypt failed with OpenSSL error - SSL_ERROR_SYSCALL.
   at Interop.OpenSsl.Encrypt(SafeSslHandle context, ReadOnlyMemory`1 input, Byte[]& output, SslErrorCode& errorCode)
   at System.Net.Security.SslStreamPal.EncryptDecryptHelper(SafeDeleteContext securityContext, ReadOnlyMemory`1 input, Int32 offset, Int32 size, Boolean encrypt, Byte[]& output, Int32& resultSize)
   --- End of inner exception stack trace ---
   at System.Net.Security.SslStream.WriteAsyncInternal[TWriteAdapter](TWriteAdapter writeAdapter, ReadOnlyMemory`1 buffer)
   at System.IO.Pipelines.StreamPipeWriter.FlushAsyncInternal(CancellationToken cancellationToken)
   at Microsoft.AspNetCore.Server.Kestrel.Core.Internal.Infrastructure.PipeWriterHelpers.ConcurrentPipeWriter.FlushAsyncAwaited(ValueTask`1 flushTask, CancellationToken cancellationToken)
   at Microsoft.AspNetCore.Server.Kestrel.Core.Internal.Infrastructure.PipeWriterHelpers.TimingPipeFlusher.TimeFlushAsyncAwaited(ValueTask`1 pipeFlushTask, MinDataRate minRate, IHttpOutputAborter outputAborter, CancellationToken cancellationToken)
fail: Microsoft.AspNetCore.Server.Kestrel[0]
      Unhandled exception while processing 0HM3KPMG2JPM0.
System.IO.IOException: The encryption operation failed, see inner exception.
 ---> Interop+OpenSsl+SslException: Encrypt failed with OpenSSL error - SSL_ERROR_SYSCALL.
   at Interop.OpenSsl.Encrypt(SafeSslHandle context, ReadOnlyMemory`1 input, Byte[]& output, SslErrorCode& errorCode)
   at System.Net.Security.SslStreamPal.EncryptDecryptHelper(SafeDeleteContext securityContext, ReadOnlyMemory`1 input, Int32 offset, Int32 size, Boolean encrypt, Byte[]& output, Int32& resultSize)
   --- End of inner exception stack trace ---
   at System.Net.Security.SslStream.WriteAsyncInternal[TWriteAdapter](TWriteAdapter writeAdapter, ReadOnlyMemory`1 buffer)
   at System.IO.Pipelines.StreamPipeWriter.FlushAsyncInternal(CancellationToken cancellationToken)
   at System.IO.Pipelines.StreamPipeWriter.CompleteAsync(Exception exception)
   at Microsoft.AspNetCore.Server.Kestrel.Core.Internal.DuplexPipeStreamAdapter`1.DisposeAsync()
   at Microsoft.AspNetCore.Server.Kestrel.Https.Internal.HttpsConnectionMiddleware.InnerOnConnectionAsync(ConnectionContext context)
   at Microsoft.AspNetCore.Server.Kestrel.Https.Internal.HttpsConnectionMiddleware.InnerOnConnectionAsync(ConnectionContext context)
   at Microsoft.AspNetCore.Server.Kestrel.Core.Internal.Infrastructure.KestrelConnection.ExecuteAsync()`

**Comment by zeinali0** [comment]
@patryk9200, In my case i don't get any error it just timeout handshaking

**Comment by patryk9200** [comment]
@zeinali0 Sometimes I've got timeout too. 
I pretty sure it's the same issue. 
Depends if I use Libuv or not I get similar exceptions like you. Try use Libuv and check what happens.

You have to add ```webBuilder.UseLibuv();``` like that:
```
 public static IHostBuilder CreateHostBuilder(string[] args)
        {
            return Host.CreateDefaultBuilder(args)
                .ConfigureWebHostDefaults(webBuilder =>
                {
                    webBuilder.UseLibuv();
                    webBuilder.UseStartup<Startup>();
                });
        }
```
and add nuget package Microsoft.AspNetCore.Server.Kestrel.Transport.Libuv.

**Comment by zeinali0** [comment]
but for me at the same time it work on other machine with same version of openssl without Libuve enabled

**Comment by patryk9200** [comment]
@zeinali0 interesting. Same code, same compilation, distribution and version, all up-to-date?
That would be weird if it would be machine dependent.

**Comment by zeinali0** [comment]
On first machine dotnet 3.1.2 didn't work
Then I test it on Other machine with dotnet 3.1.7 it worked
I update first machine to dotnet 3.1.9 but it still not working

**Comment by zeinali0** [comment]
network monitor on machine which **handshaking work fine**:
```
tcpdump port 5000 and '(tcp-syn|tcp-ack)!=0' -vv
tcpdump: listening on eth0, link-type EN10MB (Ethernet), capture size 262144 bytes
14:44:12.529258 IP (tos 0x0, ttl 127, id 3841, offset 0, flags [DF], proto TCP (6), length 52)
    _gateway.63131 > localhost.localdomain.commplex-main: Flags [S], cksum 0xbdc6 (correct), seq 1182715793, win 64240, options [mss 1460,nop,wscale 8,nop,nop,sackOK], length 0
14:44:12.529347 IP (tos 0x0, ttl 64, id 0, offset 0, flags [DF], proto TCP (6), length 52)
    localhost.localdomain.commplex-main > _gateway.63131: Flags [S.], cksum 0x964b (incorrect -> 0x6db5), seq 3096977481, ack 1182715794, win 29200, options [mss 1460,nop,nop,sackOK,nop,wscale 7], length 0
14:44:12.531227 IP (tos 0x0, ttl 127, id 3842, offset 0, flags [DF], proto TCP (6), length 40)
    _gateway.63131 > localhost.localdomain.commplex-main: Flags [.], cksum 0x1e97 (correct), seq 1, ack 1, win 513, length 0
14:44:12.572260 IP (tos 0x0, ttl 127, id 3843, offset 0, flags [DF], proto TCP (6), length 202)
    _gateway.63131 > localhost.localdomain.commplex-main: Flags [P.], cksum 0xa2f2 (correct), seq 1:163, ack 1, win 513, length 162
14:44:12.572284 IP (tos 0x0, ttl 64, id 50507, offset 0, flags [DF], proto TCP (6), length 40)
    localhost.localdomain.commplex-main > _gateway.63131: Flags [.], cksum 0x963f (incorrect -> 0x1f09), seq 1, ack 163, win 237, length 0
14:44:12.574894 IP (tos 0x0, ttl 64, id 50508, offset 0, flags [DF], proto TCP (6), length 3317)
    localhost.localdomain.commplex-main > _gateway.63131: Flags [P.], cksum 0xa30c (incorrect -> 0x46b0), seq 1:3278, ack 163, win 237, length 3277
14:44:12.581196 IP (tos 0x0, ttl 64, id 50511, offset 0, flags [DF], proto TCP (6), length 397)
    localhost.localdomain.commplex-main > _gateway.63131: Flags [P.], cksum 0x97a4 (incorrect -> 0x7ee5), seq 2921:3278, ack 163, win 237, length 357
14:44:12.592422 IP (tos 0x0, ttl 127, id 3845, offset 0, flags [DF], proto TCP (6), length 40)
    _gateway.63131 > localhost.localdomain.commplex-main: Flags [.], cksum 0x1128 (correct), seq 163, ack 3278, win 513, length 0
14:44:12.595674 IP (tos 0x0, ttl 127, id 3846, offset 0, flags [DF], proto TCP (6), length 52)
    _gateway.63131 > localhost.localdomain.commplex-main: Flags [.], cksum 0x1116 (correct), seq 163, ack 3278, win 513, options [nop,nop,sack 1 {2921:3278}], length 0
14:44:12.608631 IP (tos 0x0, ttl 127, id 3847, offset 0, flags [DF], proto TCP (6), length 47)
    _gateway.63131 > localhost.localdomain.commplex-main: Flags [P.], cksum 0xf714 (correct), seq 163:170, ack 3278, win 513, length 7
14:44:12.609596 IP (tos 0x0, ttl 64, id 50512, offset 0, flags [DF], proto TCP (6), length 40)
    localhost.localdomain.commplex-main > _gateway.63131: Flags [F.], cksum 0x963f (incorrect -> 0x1234), seq 3278, ack 170, win 237, length 0
14:44:12.612163 IP (tos 0x0, ttl 127, id 3848, offset 0, flags [DF], proto TCP (6), length 40)
    _gateway.63131 > localhost.localdomain.commplex-main: Flags [F.], cksum 0x1120 (correct), seq 170, ack 3278, win 513, length 0
14:44:12.612179 IP (tos 0x0, ttl 64, id 50513, offset 0, flags [DF], proto TCP (6), length 40)
    localhost.localdomain.commplex-main > _gateway.63131: Flags [.], cksum 0x963f (incorrect -> 0x1233), seq 3279, ack 171, win 237, length 0
14:44:12.613473 IP (tos 0x0, ttl 127, id 3849, offset 0, flags [DF], proto TCP (6), length 40)
    _gateway.63131 > localhost.localdomain.commplex-main: Flags [.], cksum 0x111f (correct), seq 171, ack 3279, win 513, length 0
```
network monitor where **handshaking not working**:

```
tcpdump port 8443 and '(tcp-syn|tcp-ack)!=0' -vv
tcpdump: listening on ens160, link-type EN10MB (Ethernet), capture size 262144 bytes
15:11:14.234875 IP (tos 0x0, ttl 127, id 37151, offset 0, flags [DF], proto TCP (6), length 52)
    10.212.134.200.64332 > db-n4.localdomain.pcsync-https: Flags [S], cksum 0xd9db (correct), seq 1560990239, win 64896, options [mss 1352,nop,wscale 8,nop,nop,sackOK], length 0
15:11:14.234975 IP (tos 0x0, ttl 64, id 0, offset 0, flags [DF], proto TCP (6), length 52)
    db-n4.localdomain.pcsync-https > 10.212.134.200.64332: Flags [S.], cksum 0x4cd4 (incorrect -> 0x0451), seq 340085818, ack 1560990240, win 29200, options [mss 1460,nop,nop,sackOK,nop,wscale 7], length 0
15:11:14.241917 IP (tos 0x0, ttl 127, id 37152, offset 0, flags [DF], proto TCP (6), length 40)
    10.212.134.200.64332 > db-n4.localdomain.pcsync-https: Flags [.], cksum 0x9f30 (correct), seq 1, ack 1, win 6147, length 0
15:11:14.262620 IP (tos 0x0, ttl 127, id 37154, offset 0, flags [DF], proto TCP (6), length 202)
    10.212.134.200.64332 > db-n4.localdomain.pcsync-https: Flags [P.], cksum 0xe12b (correct), seq 1:163, ack 1, win 6147, length 162
15:11:14.262685 IP (tos 0x0, ttl 64, id 60810, offset 0, flags [DF], proto TCP (6), length 40)
    db-n4.localdomain.pcsync-https > 10.212.134.200.64332: Flags [.], cksum 0x4cc8 (incorrect -> 0xb5a4), seq 1, ack 163, win 237, length 0
15:11:24.242340 IP (tos 0x0, ttl 64, id 60811, offset 0, flags [DF], proto TCP (6), length 40)
    db-n4.localdomain.pcsync-https > 10.212.134.200.64332: Flags [F.], cksum 0x4cc8 (incorrect -> 0xb5a3), seq 1, ack 163, win 237, length 0
15:11:24.246250 IP (tos 0x0, ttl 127, id 37156, offset 0, flags [DF], proto TCP (6), length 40)
    10.212.134.200.64332 > db-n4.localdomain.pcsync-https: Flags [.], cksum 0x9e8d (correct), seq 163, ack 2, win 6147, length 0
15:11:24.271033 IP (tos 0x0, ttl 127, id 37158, offset 0, flags [DF], proto TCP (6), length 47)
    10.212.134.200.64332 > db-n4.localdomain.pcsync-https: Flags [P.], cksum 0x847a (correct), seq 163:170, ack 2, win 6147, length 7
15:11:24.271070 IP (tos 0x0, ttl 64, id 0, offset 0, flags [DF], proto TCP (6), length 40)
    db-n4.localdomain.pcsync-https > 10.212.134.200.64332: Flags [R], cksum 0xe669 (correct), seq 340085820, win 0, length 0
15:11:24.274528 IP (tos 0x0, ttl 127, id 37159, offset 0, flags [DF], proto TCP (6), length 40)
    10.212.134.200.64332 > db-n4.localdomain.pcsync-https: Flags [F.], cksum 0x9e85 (correct), seq 170, ack 2, win 6147, length 0
15:11:24.274554 IP (tos 0x0, ttl 64, id 0, offset 0, flags [DF], proto TCP (6), length 40)
    db-n4.localdomain.pcsync-https > 10.212.134.200.64332: Flags [R], cksum 0xe669 (correct), seq 340085820, win 0, length 0
```

**Comment by patryk9200** [comment]
@zeinali0 yes, Kestrel does use OpenSSL on linux. It's exactly why I think it's the same problem.

**Comment by zeinali0** [comment]
I finally find the problem.
It was related to NTP service which probably openssl or kestrel server depends on it.
Our server is local and doesn't have access to internet so NTP service couldn't get synchronized.
After we opened internet for a while and NTP service got synchronized (`System clock synchronized: yes`), the problem solved.
```
[root@db-n4 ~]#  timedatectl status
               Local time: Tue 2020-10-20 19:28:02 +0330
           Universal time: Tue 2020-10-20 15:58:02 UTC
                 RTC time: Tue 2020-10-20 15:58:03
                Time zone: Asia/Tehran (+0330, +0330)
System clock synchronized: yes
              NTP service: active
          RTC in local TZ: no
```
