### ISSUE TITLE
Kestrel occasionally losing zero-size GRPC responses

### ISSUE THREAD

**Issue by pjc50** [dotnet/aspnetcore#53736]
### Is there an existing issue for this?

- [X] I have searched the existing issues

### Describe the bug

After upgrading from dotnet 6 to dotnet 8, we started observing intermittent failures. Trying dotnet 7 also has the same failures.

Unfortunately this bug is extremely intermittent. We have not been able to create a minimal reproduction case. So far it has only been observed on Mac systems with Java GRPC clients. I've not been able to even trigger it on my desktop, only on CI systems. It is also very timing-sensitive; adding logging to either client or server tends to slow it down just enough for the bug not to manifest. Sorry.

There is only one client, with a thread making requests, a thread making healthcheck calls, and a thread processing a long-lived stream of events structured as an infinite stream of GRPC streaming responses. The failure is roughly four minutes in, and roughly at stream 256 (but not exactly! and it varies).

Once the response is lost the RPC that made it times out 30 seconds later with DEADLINE_EXCEEDED. However, in the meantime, healthcheck calls from the other thread work just fine.

By setting the log level to Trace I was able to obtain this:

Connection id "0HN12DQ56A4EB" received HEADERS frame for stream ID 243 with length 25 and flags END_HEADERS, PRIORITY.
Connection id "0HN12DQ56A4EB" received DATA frame for stream ID 243 with length 108 and flags END_STREAM.
Request starting HTTP/2 POST http://127.0.0.1:9091/StudioLinkProtocol.StudioLinkService/SetDeviceDescription - application/grpc -
All hosts are allowed.
3 candidate(s) found for the request path '/StudioLinkProtocol.StudioLinkService/SetDeviceDescription'
Endpoint 'gRPC - /StudioLinkProtocol.StudioLinkService/SetDeviceDescription' with route pattern '/StudioLinkProtocol.StudioLinkService/SetDeviceDescription' is valid for the request path '/StudioLinkProtocol.StudioLinkService/SetDeviceDescription'
Endpoint 'gRPC - Unimplemented method for StudioLinkProtocol.StudioLinkService' with route pattern 'StudioLinkProtocol.StudioLinkService/{unimplementedMethod:grpcunimplemented}' is valid for the request path '/StudioLinkProtocol.StudioLinkService/SetDeviceDescription'
Endpoint 'gRPC - Unimplemented service' with route pattern '{unimplementedService}/{unimplementedMethod:grpcunimplemented}' is valid for the request path '/StudioLinkProtocol.StudioLinkService/SetDeviceDescription'
Request matched endpoint 'gRPC - /StudioLinkProtocol.StudioLinkService/SetDeviceDescription'
The endpoint does not specify the IRequestSizeLimitMetadata.
Executing endpoint 'gRPC - /StudioLinkProtocol.StudioLinkService/SetDeviceDescription'
Request deadline timeout of 00:00:29.9999450 started.
Reading message.
Connection id "0HN12DQ56A4EB", Request id "0HN12DQ56A4EB:000000F3": started reading request body.
Connection id "0HN12DQ56A4EB", Request id "0HN12DQ56A4EB:000000F3": done reading request body.
Deserializing 103 byte message to 'StudioLinkProtocol.SetDeviceDescriptionFile'.
Received message.
Sending message.
Serialized 'StudioLinkProtocol.OperationResult' to 0 byte message.
Message sent.
Request deadline stopped.
Executed endpoint 'gRPC - /StudioLinkProtocol.StudioLinkService/SetDeviceDescription'
Request finished HTTP/2 POST http://127.0.0.1:9091/StudioLinkProtocol.StudioLinkService/SetDeviceDescription - 200 - application/grpc 50.2121ms

### Expected Behavior

After that I would expect to see

Connection id "0HN12DQ56A4EB" sending HEADERS frame for stream ID 243 with length 4 and flags END_HEADERS.
Connection id "0HN12DQ56A4EB" sending DATA frame for stream ID 243 with length 5 and flags NONE.
Connection id "0HN12DQ56A4EB" sending HEADERS frame for stream ID 243 with length 1 and flags END_STREAM, END_HEADERS.

However there are no such messages, and eventually the client gives up and sends

Connection id "0HN12DQ56A4EB" received RST_STREAM frame for stream ID 243 with length 4 and flags 0x0.

### Steps To Reproduce

We do not have a minimal reproduction case for this.

### .NET Version

8.0.101

### Anything else?

Grpc.AspNetCore 2.59.0
MacOS 13.6.3 BuildVersion: 22G436 (Ventura)

**Comment by pjc50** [comment]
It is possible that the preceding request is relevant, which transfers a large amount of data including a couple of window updates, settings, and ping frames.

Connection id "0HN12DQ56A4EB" sending DATA frame for stream ID 241 with length 16384 and flags NONE.
Connection id "0HN12DQ56A4EB" sending DATA frame for stream ID 241 with length 9510 and flags NONE.
Connection id "0HN12DQ56A4EB" received PING frame for stream ID 0 with length 8 and flags NONE.
Connection id "0HN12DQ56A4EB" sending PING frame for stream ID 0 with length 8 and flags ACK.
Connection id "0HN12DQ56A4EB" received WINDOW_UPDATE frame for stream ID 0 with length 4 and flags 0x0.
Connection id "0HN12DQ56A4EB" received WINDOW_UPDATE frame for stream ID 241 with length 4 and flags 0x0.
Connection id "0HN12DQ56A4EB" received WINDOW_UPDATE frame for stream ID 0 with length 4 and flags 0x0.
Connection id "0HN12DQ56A4EB" received SETTINGS frame for stream ID 0 with length 6 and flags NONE.
Connection id "0HN12DQ56A4EB" sending SETTINGS frame for stream ID 0 with length 0 and flags ACK.
Connection id "0HN12DQ56A4EB" sending DATA frame for stream ID 241 with length 16384 and flags NONE.
(repeated many times)
Connection id "0HN12DQ56A4EB" sending DATA frame for stream ID 241 with length 16384 and flags NONE.
Connection id "0HN12DQ56A4EB" sending DATA frame for stream ID 241 with length 9510 and flags NONE.
Connection id "0HN12DQ56A4EB" received PING frame for stream ID 0 with length 8 and flags NONE.
Connection id "0HN12DQ56A4EB" sending PING frame for stream ID 0 with length 8 and flags ACK.
Connection id "0HN12DQ56A4EB" received WINDOW_UPDATE frame for stream ID 241 with length 4 and flags 0x0.
Connection id "0HN12DQ56A4EB" received WINDOW_UPDATE frame for stream ID 0 with length 4 and flags 0x0.
Connection id "0HN12DQ56A4EB" received WINDOW_UPDATE frame for stream ID 241 with length 4 and flags 0x0.
Connection id "0HN12DQ56A4EB" sending DATA frame for stream ID 241 with length 16384 and flags NONE.
Connection id "0HN12DQ56A4EB" sending DATA frame for stream ID 241 with length 16384 and flags NONE.
Connection id "0HN12DQ56A4EB" sending DATA frame for stream ID 241 with length 16384 and flags NONE.
Connection id "0HN12DQ56A4EB" sending DATA frame for stream ID 241 with length 16384 and flags NONE.
Connection id "0HN12DQ56A4EB" sending DATA frame for stream ID 241 with length 5732 and flags NONE.
Connection id "0HN12DQ56A4EB" sending HEADERS frame for stream ID 241 with length 1 and flags END_STREAM, END_HEADERS.
Connection id "0HN12DQ56A4EB" received SETTINGS frame for stream ID 0 with length 6 and flags NONE.
Connection id "0HN12DQ56A4EB" sending SETTINGS frame for stream ID 0 with length 0 and flags ACK.
Connection id "0HN12DQ56A4EB" received PING frame for stream ID 0 with length 8 and flags NONE.
Connection id "0HN12DQ56A4EB" sending PING frame for stream ID 0 with length 8 and flags ACK.

**Comment by Tratcher** [comment]
Receiving repeated SETTINGS frames is suspicious. Any chance you can get a trace of those? The connection logging middleware would help, or wireshark if it's decrypted.
https://learn.microsoft.com/en-us/aspnet/core/fundamentals/servers/kestrel/connection-middleware?view=aspnetcore-8.0#connection-logging

**Comment by pjc50** [comment]
I think that's possible, will see on Monday.

**Comment by pjc50** [comment]
Wireshark output for the last SETTINGS before the failure and its ack:

Frame 30651: 71 bytes on wire (568 bits), 71 bytes captured (568 bits) on interface lo0, id 0
Null/Loopback
Internet Protocol Version 4, Src: 127.0.0.1, Dst: 127.0.0.1
Transmission Control Protocol, Src Port: 61800, Dst Port: 9091, Seq: 9766, Ack: 2903349, Len: 15
HyperText Transfer Protocol 2
    Stream: SETTINGS, Stream ID: 0, Length 6
        Length: 6
        Type: SETTINGS (4)
        Flags: 0x00
        0... .... .... .... .... .... .... .... = Reserved: 0x0
        .000 0000 0000 0000 0000 0000 0000 0000 = Stream Identifier: 0
        Settings - Initial Windows size : 1559026
            Settings Identifier: Initial Windows size (4)
            Initial Window Size: 1559026

Frame 30658: 65 bytes on wire (520 bits), 65 bytes captured (520 bits) on interface lo0, id 0
Null/Loopback
Internet Protocol Version 4, Src: 127.0.0.1, Dst: 127.0.0.1

Transmission Control Protocol, Src Port: 9091, Dst Port: 61800, Seq: 2974777, Ack: 9781, Len: 9
HyperText Transfer Protocol 2
    Stream: SETTINGS, Stream ID: 0, Length 0
        Length: 0
        Type: SETTINGS (4)
        Flags: 0x01, ACK
        0... .... .... .... .... .... .... .... = Reserved: 0x0
        .000 0000 0000 0000 0000 0000 0000 0000 = Stream Identifier: 0

[Selected packets dotnet issue.zip](https://github.com/dotnet/aspnetcore/files/14168248/Selected.packets.dotnet.issue.zip)

**Comment by noocyte** [comment]
We hit what looks like the same bug on **ASP.NET Core 10.0.12** (Linux, Kestrel h2c, Grpc.AspNetCore 2.83.0, .NET `SocketsHttpHandler`/Grpc.Net.Client 2.83.0 as the client). It is not limited to zero-size responses: our lost response is about 430 KB. Rate: 1 lost response in about 26,700 HTTP/2 requests in a 19-minute run across 37 server processes. It only ever hits the service whose responses span several stream windows.

**Kestrel trace for the lost stream (149).** The preceding stream on the same connection (147) is a 430 KB response: 27 DATA frames, stream WINDOW_UPDATEs interleaved, trailers, and then four more WINDOW_UPDATEs for 147 arrive *after* its trailers were sent. 284 ms later stream 149 arrives, the app completes, hosting logs `Request finished 200`, and Kestrel never sends a single frame for 149. The next stream (151), 300 ms later, is served normally.

```
11:01:59.984 received HEADERS frame for stream ID 147 with length 376 and flags END_HEADERS.
11:01:59.987 sending HEADERS frame for stream ID 147 with length 34 and flags END_HEADERS.
             ... 27 DATA frames for 147, 11 received WINDOW_UPDATE for 147 in between ...
11:01:59.988 sending DATA frame for stream ID 147 with length 11868 and flags NONE.
11:01:59.988 sending HEADERS frame for stream ID 147 with length 1 and flags END_STREAM, END_HEADERS.
11:01:59.988 received WINDOW_UPDATE frame for stream ID 147 with length 4 and flags 0x0.   (x4)
11:02:00.272 received HEADERS frame for stream ID 149 with length 376 and flags END_HEADERS.
11:02:00.272 received DATA frame for stream ID 149 with length 135 and flags NONE.
11:02:00.272 received DATA frame for stream ID 149 with length 0 and flags END_STREAM.
11:02:00.272 Request starting HTTP/2 POST http://localhost:5343/templateservice.TemplateService/Get - application/grpc null
11:02:00.275 Request finished HTTP/2 POST http://localhost:5343/templateservice.TemplateService/Get - 200 null application/grpc 3.1234ms
             (no outgoing frame for stream 149 at any later time)
11:02:00.578 received HEADERS frame for stream ID 151 with length 376 and flags END_HEADERS.
11:02:00.581 sending HEADERS frame for stream ID 151 with length 34 and flags END_HEADERS.
             ... full 430 KB response for 151 ...
11:04:00.286 received RST_STREAM frame for stream ID 149 with length 4 and flags 0x0.        (client deadline)
```

The client side (`Private.InternalDiagnostics.System.Net.Http` trace) confirms no frame for stream 149 arrived. No Kestrel warning or error was logged on the connection. **There were no repeated SETTINGS frames**: the connection saw only the initial SETTINGS exchange at 11:01:35, so the increasing-window SETTINGS from the original report are not a necessary condition.

**Pattern across our three occurrences** (two on CI, one local): the lost stream was in every case the very next stream on the connection after a completed large response. Kestrel pools `Http2Stream` objects LIFO, so that next stream reuses the object of the stream that just completed.

**Possible mechanism, from reading release/10.0.** `Http2OutputProducer.StreamReset` resets every scheduling field except `_isScheduled`. `Http2FrameWriter.WriteToOutputPipe` dequeues with `while (_channel.Reader.TryRead(out var producer) && !producer.CompletedResponse)`, so a producer that was scheduled once more while its final write was in flight is dropped after `CompleteResponseAsync` without ever reaching `ObserveDataAndState`, which is the only place `_isScheduled` is cleared. A reused stream then inherits `_isScheduled == true`, and every `Schedule()` for the new stream returns early. That matches the trace exactly, including "only the stream right after a completed multi-window response". I could not pin down which `Schedule()` call races the final write; the late stream WINDOW_UPDATEs after the trailers are the obvious suspect. Resetting `_isScheduled` in `StreamReset` (or clearing it when the loop skips a completed producer) would make the reuse safe regardless of the race.

I can share the full trace logs for the run if that helps.
